"PPI Mechanical Engineering Reference Manual, 14th Edition (Hardcover) – Comprehensive Reference Manual for the NCEES PE Exam", "Made Easy", Mechanical Engineering,  4.25 avg rating — 4 ratings
"Centrifugal Pump Clinic (Mechanical Engineering Series)", "Richard G. Budynas", Mechanical Engineering,  4.50 avg rating — 4 ratings
"MECHANICAL VIBRATION -SEMESTER VI -MECHANICAL /AUTOMOBILE ENGINEERING", "J. Keith Nisbett", Mechanical Engineering,  4.00 avg rating — 2 ratings
"Mechanical Technical Interview: Mechanical Engineering Interview Questions and Answers", "Jan F. Kreider", Mechanical Engineering,  3.25 avg rating — 4 ratings
"Is There a Mechanical Engineer Inside You?: A Student's Guide To Exploring Careers in Mechanical Engineering and Mechanical Engineering Technology", "Michael R. Lindeburg", Mechanical Engineering,  3.17 avg rating — 12 ratings
"A Dictionary of Mechanical Engineering", "Igor J. Karassik", Mechanical Engineering,  4.30 avg rating — 10 ratings
"MECHANICAL ENGINEERING", "DR.F.B.SAYYAD", Mechanical Engineering,  5.00 avg rating — 2 ratings
"Proceedings of the Asme International Mechanical Engineering Congress and Exposition--2008: Presented at 2008 Asme International Mechanical Engineering Congress and Exposition, October 31-November 6, 2008, Boston, Massachusetts, USA", "tech -max", Mechanical Engineering,  1.00 avg rating — 1 rating
"GATE Tutor 2017 Mechanical Engineering", "Dinesh Nath Goswami", Mechanical Engineering,  3.40 avg rating — 5 ratings
"Mechanical Engineering GATE 2018", "Dinesh Nath Goswami", Mechanical Engineering,  3.00 avg rating — 2 ratings
"GATE 2019 MECH Practice Booklet 1116 Expected Questions with Solutions for Mechanical Engineering Volume 1", "Subject Experts of the ACE Engineering Academy", Mechanical Engineering,  2.88 avg rating — 8 ratings
"Basic Mechanical Engineering", "Pravin Kumar", Mechanical Engineering,  4.17 avg rating — 6 ratings
"Basic Programs for Steam Plant Engineers: Boilers, Combustion, Fluid Flow and Heat Transfer (Mechanical Engineering", "V. Ganapathy", Mechanical Engineering,  4.43 avg rating — 7 ratings
"All about Mechanical Engineering", "Don Herweck", Mechanical Engineering,  2.25 avg rating — 4 ratings
"Mechanical Engineering Objective: Mechanical Engineering Objective Questions with Answers", "Pranab Debnath", Mechanical Engineering,  4.83 avg rating — 6 ratings
"Mechanical Engineering", "Don Herweck", Mechanical Engineering,  2.78 avg rating — 9 ratings
"Vehicle Stability (Mechanical Engineering", "Dean C. Karnopp", Mechanical Engineering,  4.75 avg rating — 4 ratings
"Gate 2018: Mechanical Engineering Solved Papers", "Made Easy Editorial Board", Mechanical Engineering,  3.62 avg rating — 8 ratings
"Mechanical Engineering for the Curious: Why Study Mechanical Engineering?", "Kishor Vaidya", Mechanical Engineering,  4.20 avg rating — 5 ratings
"Mechanical Engineering Review Manual: A Complete Review Course for the P.E. Examination for Mechanical Engineers", "John Crepeau", Mechanical Engineering,  5.00 avg rating — 3 ratings
"A Degree in a Book: Electrical and Mechanical Engineering: Everything You Need to Know to Master the Subject - In One Book!", "Grant Crawford", Mechanical Engineering,  3.80 avg rating — 5 ratings
"Mechanical Engineering for Hackers: A Guide to Designing, Prototyping, and Manufacturing Hardware", "Michael R. Lindeburg", Mechanical Engineering,  4.00 avg rating — 1 rating
"A Textbook Of Elemetns Of Mechanical Engineering", "David Baker", Mechanical Engineering,  5.00 avg rating — 1 rating
"2016 Gate Mechanical Engineering and PI Engineering", "Will Mcleod", Mechanical Engineering,  4.25 avg rating — 4 ratings
"Basics of Mechanical Engineering: By Knowledge flow", "S. Trymbaka Murthy", Mechanical Engineering,  3.33 avg rating — 6 ratings
"The CRC Handbook of Mechanical Engineering", "Made Easy", Mechanical Engineering,  4.50 avg rating — 4 ratings
"Basic Mechanical Engineering", "Knowledge flow", Mechanical Engineering,  5.00 avg rating — 1 rating
"Elements Of Mechanical Engineering: For K.U, M.D.U. And G.J.U. Haryana", "Raj Kumar Jat", Mechanical Engineering,  2.83 avg rating — 6 ratings
"Question Bank in Electronics & Communication Engineering", "J.B. Gupta", Electronics Engineering,  3.40 avg rating — 99 ratings
"Basic Electrical and Electronics Engineering", "R. Muthusubramanian", Electronics Engineering,  4.53 avg rating — 57 ratings
"Basic Electrical and Electronics Engineering Book", "K.R. Niazi", Electronics Engineering,  3.99 avg rating — 68 ratings
"Basic Electrical and Electronics Engineering", "S.K. Bhattacharya", Electronics Engineering,  3.58 avg rating — 50 ratings
"Electrical Electronics And Telecommunication Engineering", "B.L. Theraja", Electronics Engineering,  4.29 avg rating — 83 ratings
"An Integrated Course in Electronics & Communication Engineering", "J.B. Gupta", Electronics Engineering,  4.06 avg rating — 33 ratings
"A Textbook of Basic Electrical and Electronics Engineering", "J.B. Gupta", Electronics Engineering,  3.69 avg rating — 16 ratings
"Electrical and Electronics Engineering Materials", "J.B. Gupta", Electronics Engineering,  3.83 avg rating — 12 ratings
"Fundamentals of Electrical and Electronics Engineering", "Smarajit Ghosh", Electronics Engineering,  4.08 avg rating — 13 ratings
"Objective Electronics Engineering for (Diploma) Competitive Exams", "GKP", Electronics Engineering,  3.71 avg rating — 14 ratings
"A Textbook of Electronics Engineering", "Sanjay Sharma", Electronics Engineering,  3.14 avg rating — 7 ratings
"Electronics and Communication Engineering Handbook: For ECE Competitive Examinations", "Susurla V S Suresh", Electronics Engineering,  3.00 avg rating — 6 ratings
"Basic Electrical and Electronics Engineering", "P.V. Prasad", Electronics Engineering,  3.33 avg rating — 9 ratings
"Basic Electrical and Electronics Engineering", "R. Prasad", Electronics Engineering,  4.33 avg rating — 3 ratings
"Basic Electronics Solid State ; For The Examinations Of B.E. (Electronics And Communication), Diploma In Electronics And Communication. Engineering (Ece), B.Sc. (Electronics), City And Guilds London I", "S. Sivanagaraju", Electronics Engineering,  4.02 avg rating — 1,018 ratings
"Electronics and Communication Engineering for GATE", "B.R. Patil", Electronics Engineering,  3.00 avg rating — 7 ratings
"Basic Electrical and Electronics Engineering", "B.L. Theraja", Electronics Engineering,  4.33 avg rating — 3 ratings
"Electronics & Communication Engineering", "Kishore Kashyap", Electronics Engineering,  4.50 avg rating — 4 ratings
"CONCEPTS OF ELECTRICAL AND ELECTRONICS ENGINEERING", "R.K. Rajput", Electronics Engineering,  4.75 avg rating — 8 ratings
"TANCET M.E Electrical, Electronics and Instrumentation Engineering", "Rajput R.K.", Electronics Engineering,  0.00 avg rating — 0 ratings
"Basics of Electrical Electronics and Communication Engineering: Conceptual Approach", "K.A. Navas", Electronics Engineering,  3.25 avg rating — 4 ratings
"Question Bank in Electronics & Communication Engineering", "T.A. Suhail", Electronics Engineering,  2.75 avg rating — 4 ratings
"Principles Of Electrical Engineering And Electronics", "Sanjay Sharma", Electronics Engineering,  3.98 avg rating — 441 ratings
"Wiley Encyclopedia of Electrical and Electronics Engineering, 24 Volume Set", "V.K. Mehta", Electronics Engineering,  4.00 avg rating — 3 ratings
"Electrical and Electronics Engineering", "John G. Webster", Electronics Engineering,  4.00 avg rating — 3 ratings
"An Integrated Course in Electronics Engineering", "Knowledge flow", Electronics Engineering,  5.00 avg rating — 3 ratings
"Basic Electrical and Electronics Engineering", "J.B. Gupta", Electronics Engineering,  2.33 avg rating — 6 ratings
"Electronics & Communication Engineering GATE 2018", "D.P. Kothari", Electronics Engineering,  4.40 avg rating — 5 ratings
"Fundamentals Of Electrical Engineering And Electronics", "I.J. Nagrath", Electronics Engineering,  4.09 avg rating — 495 ratings
"Handbook Series of Electronics & Communication Engineering", "Ankit Goel", Electronics Engineering,  3.83 avg rating — 6 ratings
"Basic Electrical and Electronics Engineering", "Alka Singh", Electronics Engineering,  1.75 avg rating — 4 ratings
"Basics of Electrical & Electronics Engineering for Diploma Karnataka (Sem-I Electronics & Communication Course 2015)", "B.L. Theraja", Electronics Engineering,  4.00 avg rating — 4 ratings
"Basic Electrical and Electronics Engineering, 1e", "Experts Compilation", Electronics Engineering,  3.33 avg rating — 3 ratings
"Handbook for Electronics Engineering Technicians", "M.S. Sukhija", Electronics Engineering,  4.00 avg rating — 3 ratings
"A Handbook on Electronics & Communication Engineering", "T.K. Nagsarkar", Electronics Engineering,  4.00 avg rating — 6 ratings
"Engineering Basics: Electrical, Electronics and Computer Engineering", "U.A. Bakshi", Electronics Engineering,  3.40 avg rating — 5 ratings
"Understanding Automotive Electronics: An Engineering Perspective", "V.U. Bakshi", Electronics Engineering,  2.75 avg rating — 4 ratings
"Question Bank In Electrical Electronics Engineering", "D.P. Kothari", Electronics Engineering,  3.33 avg rating — 3 ratings
"A Textbook of Electronics Engineering", "I J Nagrath", Electronics Engineering,  0.00 avg rating — 0 ratings
"BSNL, DRDO, ISRO: Electronics and Communication Engineering Previous Year - Solved Papers and Practice Papers 2015", "Milton Kaufman", Electronics Engineering,  3.50 avg rating — 4 ratings
"BASIC ELECTRICAL & ELECTRONICS ENGINEERING", "Ravish Singh", Electronics Engineering,  5.00 avg rating — 5 ratings
"Basic Electrical And Electronics Engineering", "Manoj Kumar", Electronics Engineering,  3.50 avg rating — 2 ratings
"Electronics Engineering", "Sudhir Sharma", Electronics Engineering,  3.40 avg rating — 5 ratings
"TANGED CO & CORPORATION OF CHENNAI / Assistant Engineer / Electronics & Communication Engineering", "Jagjit Malhotra", Electronics Engineering,  0.00 avg rating — 0 ratings
"Electronics and Communication Engineering GATE 2019", "N. Pandey Onkar", Electronics Engineering,  3.80 avg rating — 5 ratings
"Analysis and synthesis of linear control systems (HRW series in electrical engineering, electronics, and systems)", "N. Pandey Onkar", Electronics Engineering,  4.50 avg rating — 10 ratings
"GATE-2014 Electronics & Communication Engineering", "V.Santhan Krishnan,M.presh Nave DR.Antony Xavier", Electronics Engineering,  0.00 avg rating — 0 ratings
"Introduction To Electrical , Electronics And Communication Engineering", "Ankit Goel", Electronics Engineering,  2.00 avg rating — 1 rating
"A Dictionary of Electronics and Electrical Engineering", "Alka Singh", Electronics Engineering,  3.67 avg rating — 3 ratings
"TANCET M.E ENTRANCE - ELECTRONICS AND COMMUNICATION ENGINEERING", "Chi-Tsong Chen", Electronics Engineering,  0.00 avg rating — 0 ratings
"Gate 2018: Electronics Engineering Solved Papers", "J.B. Gupta", Electronics Engineering,  4.29 avg rating — 7 ratings
"From Compass to Computer: History of Electrical and Electronics Engineering", "S. Pooranchandra", Electronics Engineering,  4.00 avg rating — 1 rating
"GATE Tutor 2015 Electronics & Communication Engineering", "B. Sasikala", Electronics Engineering,  5.00 avg rating — 1 rating
"Basic Electronics Engineering for SPPU 19 Course (FE - I - Common - 104010) - 2020 Edition", "Afzal Khan", Electronics Engineering,  0.00 avg rating — 0 ratings
"Gateway To Gate", "Andrew Butterfield", Electronics Engineering,  3.00 avg rating — 1 rating
"Basic Electronics Engineering", "M. PRESHNAVE", Electronics Engineering,  0.00 avg rating — 0 ratings
"GATE Guide Electronics & Communication Engineering 2018", "Made Easy Editorial Board", Electronics Engineering,  3.20 avg rating — 5 ratings
"Gate Guide Electronics & Communication Engineering 2017", "W.A. Atherton", Electronics Engineering,  3.50 avg rating — 4 ratings
"Objective Electronics & Telecommunication Engineering", "Er.Ankit Goel", Electronics Engineering,  2.00 avg rating — 1 rating
"Electrical and Electronics Engineering for Scientists and Engineers", "Alka Singh", Electronics Engineering,  5.00 avg rating — 1 rating
"Wiley Acing the Gate: Electronics and Communication Engineering", "Anil K. Maini", Electronics Engineering,  3.00 avg rating — 2 ratings
"DRDO (CEPTAM) Sr. Tech. Asst. Electronics & Communication Engg.: Senior Technical Assistant Electronics & Communication Engineering", "Varsha Agrawal", Electronics Engineering,  5.00 avg rating — 2 ratings
"Introduction to linear system theory (Holt, Rinehart and Winston series in electrical engineering, electronics and systems)", "Nakul Maini", Electronics Engineering,  3.00 avg rating — 1 rating
"Electronics And Communication Engineering", "GKP", Electronics Engineering,  0.00 avg rating — 0 ratings
"GATE Tutor 2017 Electronics & Communication Engineering", "Chi-Tsong Chen", Electronics Engineering,  4.75 avg rating — 4 ratings
"Wiley Encyclopedia of Electrical and Electronics Engineering, Volume 4", "Handa", Electronics Engineering,  0.00 avg rating — 0 ratings
"Basic Electrical and Electronics Engineering-II: For Wbut", "Arihant", Electronics Engineering,  0.00 avg rating — 0 ratings
"Assessment of the National Institute of Standards and Technology Electronics and Electrical Engineering Laboratory: Fiscal Year 2007", "Ankit Goel", Electronics Engineering,  0.00 avg rating — 0 ratings
"Objective Electronics & Communication Engineering", "Alka Singh", Electronics Engineering,  4.00 avg rating — 2 ratings
"Handbook of Electronics and Communication Engineering", "John G. Webster", Electronics Engineering,  4.00 avg rating — 2 ratings
"Electrical and Electronics Engineering Materials", "S.K. Bhattacharya", Electronics Engineering,  0.00 avg rating — 0 ratings
"Engineering Electronics: A Practical Approach", "National Research Panel on Electronics and Electrical Engineering", Electronics Engineering,  0.00 avg rating — 0 ratings
"Basic Electronics Engineering And Devices", "G.K. Mithal", Electronics Engineering,  5.00 avg rating — 1 rating
"An Assessment of the National Institute of Standards and Technology Electronics and Electrical Engineering Laboratory: Fiscal Year 2009", "RPH Editorial Board", Electronics Engineering,  0.00 avg rating — 0 ratings
"MMIC Transmission Lines, Circuits and Antennas", "Banerjee G.K", Electronics Engineering,  4.00 avg rating — 1 rating
"ENGLISH AND HINDI MEDIUM SSC SCIENTIFIC ASSISTANT RRB JE AND SSE: ELECTRONICS ENGINEERING (20180823 Book 176)", "Robert Mauro", Electronics Engineering,  0.00 avg rating — 0 ratings
"GATE Electronics and Communication Engineering | GATE 2020 | By Pearson", "Anish Dixit", Electronics Engineering,  0.00 avg rating — 0 ratings
"Electronics Engineering", "Panel on Electronics and Electrical Engineering", Electronics Engineering,  4.67 avg rating — 3 ratings
"GATE 2015 Electronics & Telecommunication Engineering", "National Research Council", Electronics Engineering,  3.33 avg rating — 3 ratings
"GATE-15 Electronics & Communication Engineering", "Laboratory Assessments Board", Electronics Engineering,  4.50 avg rating — 2 ratings
"Chapterwise Previous Years' Solved Papers (2014 - 2000) Gate Electronics and Communication Engineering", "Manish Purbey", Electronics Engineering,  4.50 avg rating — 2 ratings
"GATE-2020 Electronics & Communication Engineering Previous GATE Questions with Solutions, Subjectwise & Chapterwise", "ACE Engineering Academy", Electronics Engineering,  4.00 avg rating — 3 ratings
"GATE 2019 Previous Year Solved Questions Electronics and Communication Engineering", "Kreatryx Publications", Electronics Engineering,  4.00 avg rating — 1 rating
"The Applied Electronics Engineering Handbook", "This book contains all subjects of GATE Electronics and Communication Engineering including Engineer", Electronics Engineering,  4.50 avg rating — 2 ratings
"Power Electronics Handbook", "Ankit Goyal", Electronics Engineering,  4.33 avg rating — 3 ratings
"Multiple Choice Questions in Electronics and Electrical Engineering", "Robert J. Herrick", Electronics Engineering,  4.00 avg rating — 3 ratings
"Trb-Lecturers Electronics And Communication Engineering", "Fraidoon Mazda", Electronics Engineering,  0.00 avg rating — 0 ratings
"Basics of Electronics Engineering- APJ Abdul Kalam Kerala Technological University", "T.J. Davies", Electronics Engineering,  0.00 avg rating — 0 ratings
"Multiple Choice Questions In Electronics And Electrical Engineering", "M.PRESH NAVE", Electronics Engineering,  0.00 avg rating — 0 ratings
"ELECTRICAL AND ELECTRONICS ENGINEERING MATERIALS", "Various", Electronics Engineering,  5.00 avg rating — 1 rating
"A Handbook on Electronics Engineering", "K.A. Navas", Electronics Engineering,  2.00 avg rating — 1 rating
"Basic Electronics Engineering Handbook", "T.A. Suhail", Electronics Engineering,  4.00 avg rating — 1 rating
"GATE-16 Electronics & Communication Engineering", "Thomas J. Davies", Electronics Engineering,  3.00 avg rating — 1 rating
"Question Bank on Electrical and Electronics Engineering with Question Papers from Various Competitive and Recruitment Examinations Part II", "G.K. Banerjee", Electronics Engineering,  0.00 avg rating — 0 ratings
"C for Electronics and Computer Engineering Technology", "Made Easy Team", Electronics Engineering,  3.00 avg rating — 2 ratings
"Basic Electrical, Electronics and Computer Engineering", "Ravi Kumar", Electronics Engineering,  2.00 avg rating — 1 rating
"Mini Projects for Electronics and Communication Engineering Students", "ACE Engineering", Electronics Engineering,  5.00 avg rating — 1 rating
"Gate in 75 Days-Electronics and Communication Engineering", "C. Harish Rai", Electronics Engineering,  0.00 avg rating — 0 ratings
"EEE Interview and Viva Questions and Answers in Hindi: Electrical and Electronics Engineering (Learneee1 Book 965078901)", "Peter J. Holsberg", Electronics Engineering,  3.50 avg rating — 2 ratings
"GATE Electronics and Communication Engineering 2018", "R. Muthusubramanian", Electronics Engineering,  5.00 avg rating — 1 rating
"Applied Mathematics for Business, Economics, and the Social Sciences", "Frank S. Budnick", Social Science,  4.06 avg rating — 1,018 ratings
"Evergreen Self Study In Social Science Term-I class 9", "K.S.Randhawa", Social Science,  3.56 avg rating — 400 ratings
"All In One Social Science class Class 9", "handmark", Social Science,  3.67 avg rating — 255 ratings
"Evergreen CBSE Self Study in Social Science Term II for Class 9", "Arihant Experts", Social Science,  3.77 avg rating — 289 ratings
"CBSE All In One Social Science Class 10", "K.S. Randhawa", Social Science,  3.56 avg rating — 323 ratings
"Xam idea cce series social science class 9th", "Arihant Experts", Social Science,  3.49 avg rating — 258 ratings
"Duped: Truth-Default Theory and the Social Science of Lying and Deception", "VK Global Publications", Social Science,  3.65 avg rating — 100 ratings
"DAV - Social Science Class 8", "Timothy R. Levine", Social Science,  3.65 avg rating — 162 ratings
"Explaining Social Behavior: More Nuts and Bolts for the Social Sciences", "Full Marks", Social Science,  3.99 avg rating — 309 ratings
"Together with Social Science - 9", "Jon Elster", Social Science,  3.74 avg rating — 172 ratings
"All in One Social Science CBSE Class 9 Term - II", "Rachna Sagar", Social Science,  3.60 avg rating — 119 ratings
"Social Intelligence: The New Science of Human Relationships", "Gajendra Singh", Social Science,  3.99 avg rating — 12,635 ratings
"Reform or Revolution & Other Writings (Books on History, Political & Social Science)", "Madhumita Pattrea", Social Science,  4.18 avg rating — 261 ratings
"xam idea social science term 2 class 10", "Daniel Goleman", Social Science,  3.54 avg rating — 97 ratings
"All In One Social Science Class 10 Term 2: CBSE", "Rosa Luxemburg", Social Science,  3.66 avg rating — 92 ratings
"Introductory Mathematical Analysis for Business, Economics, and the Life and Social Sciences", "Paul M. Buhle", Social Science,  3.84 avg rating — 151 ratings
"Social Engineering: The Science of Human Hacking", "VK Global Publications", Social Science,  4.02 avg rating — 252 ratings
"S. Chand's Social Science for Class - 10", "Gajendra Singh", Social Science,  3.48 avg rating — 77 ratings
"The Methodology of the Social Sciences", "Madhumita Pattrea", Social Science,  3.94 avg rating — 169 ratings
"CBSE Self Study in Social Science Term II Class - 10", "Ernest F. Haeussler Jr.", Social Science,  3.32 avg rating — 47 ratings
"Student Solutions Manual for Harshbarger/Reynolds Mathematical Applications for the Management, Life, and Social Sciences, 9th", "Ronald J. Harshbarger", Social Science,  3.89 avg rating — 63 ratings
"All In One Social Science Class 8th", "James J. Reynolds", Social Science,  3.50 avg rating — 36 ratings
"Octavia's Brood: Science Fiction Stories from Social Justice Movements", "Arihant Experts", Social Science,  3.94 avg rating — 3,263 ratings
"Weaponizing Anthropology: Social Science in Service of the Militarized State", "Adrienne Maree Brown", Social Science,  3.88 avg rating — 59 ratings
"Making Social Science Matter: Why Social Inquiry Fails and How It Can Succeed Again", "Walidah Imarisha", Social Science,  4.02 avg rating — 215 ratings
"Evergreen 100% Success SQP in Social Science (Class 10)", "Sheree Renée Thomas", Social Science,  3.54 avg rating — 41 ratings
"Humanizing Big Data: Marketing at the Meeting of Data, Social Science & Consumer Insight", "David H. Price", Social Science,  3.72 avg rating — 40 ratings
"The Uniqueness of Western Civilization", "Bent Flyvbjerg", Social Science,  4.29 avg rating — 52 ratings
"Interviewing as Qualitative Research: A Guide for Researchers in Education and the Social Sciences", "Steven Sampson", Social Science,  3.92 avg rating — 291 ratings
"Growing Artificial Societies: Social Science from the Bottom Up", "K.S. Randhawa", Social Science,  4.15 avg rating — 124 ratings
"Doing a Literature Review: Releasing the Social Science Research Imagination", "Fr. Thomas Remigius", Social Science,  3.63 avg rating — 167 ratings
"Salsa Dancing Into the Social Sciences: Research in an Age of Info-Glut", "Colin Strong", Social Science,  4.09 avg rating — 221 ratings
"Oswaal CBSE Chapterwise and Topicwise Question Bank with Complete Solutions for Class 10 Social Science (For March 2018 Exam)", "Ricardo Duchesne", Social Science,  4.17 avg rating — 36 ratings
"Case Studies and Theory Development in the Social Sciences", "Irving Seidman", Social Science,  3.83 avg rating — 157 ratings
"Doing Your Research Project: A Guide for First-Time Researchers in Education, Health and Social Science", "Joshua M. Epstein", Social Science,  3.59 avg rating — 210 ratings
"The Health of People: How the social sciences can improve population health", "Robert Axtell", Social Science,  4.00 avg rating — 3 ratings
"Southern Theory: The Global Dynamics of Knowledge in Social Science", "Chris Hart", Social Science,  3.89 avg rating — 82 ratings
"Learn to Write Badly: How to Succeed in the Social Sciences", "Kristin Luker", Social Science,  4.00 avg rating — 80 ratings
"Teaching the Social Sciences and History in Secondary Schools: A Methods Book", "Panel of Experts", Social Science,  3.25 avg rating — 8 ratings
"After Method: Mess in Social Science Research", "Alexander L. George", Social Science,  4.09 avg rating — 100 ratings
"Cultural Evolution: How Darwinian Theory Can Explain Human Culture and Synthesize the Social Sciences", "Alex Mesoudi", Social Science,  3.92 avg rating — 71 ratings
"End of the World as We Know It: Social Science for the Twenty-First Century", "Immanuel Wallerstein", Social Science,  3.98 avg rating — 109 ratings
"Statistical Methods for the Social Sciences", "Alan Agresti", Social Science,  3.37 avg rating — 191 ratings
"Cambridge Social Sciences 7: CBSE Middle School Social Sciences", "Barbara Finlay", Social Science,  3.90 avg rating — 31 ratings
"Student's Solution Manual for Calculus for Business, Economics, and the Social and Life Sciences", "Devyani Kapoor", Social Science,  4.07 avg rating — 28 ratings
"New Getting Ahead In Social Science (Geography) - Class 7", "Reeta David", Social Science,  4.04 avg rating — 28 ratings
"Mathematical Applications For The Management, Life, And Social Sciences", "Madhuri Gupta", Social Science,  3.88 avg rating — 67 ratings
"The Idea of a Social Science: And Its Relation to Philosophy", "Laurence D. Hoffmann", Social Science,  3.62 avg rating — 134 ratings
"Across the Boundaries: Extrapolation in Biology and Social Science", "Gerald L. Bradley", Social Science,  3.68 avg rating — 66 ratings
"The Philosophy of Social Science: An Introduction", "Panel of Expert Authors", Social Science,  3.57 avg rating — 77 ratings
"Body Ritual Among the Nacirema (Reprint Series in Social Sciences)", "Ronald J. Harshbarger", Social Science,  4.26 avg rating — 136 ratings
"Research Methods in the Social Sciences w/Data Bank CD", "James J. Reynolds", Social Science,  3.59 avg rating — 74 ratings
"My Autobiography / The Political & Social Doctrine of Fascism (Books on History, Political & Social Science)", "Peter Winch", Social Science,  3.43 avg rating — 76 ratings
"Causal Inference for Statistics, Social, and Biomedical Sciences: An Introduction", "Daniel Steel", Social Science,  4.46 avg rating — 48 ratings
"Quantum Mind and Social Science: Unifying Physical and Social Ontology", "Martin Hollis", Social Science,  4.33 avg rating — 60 ratings
