"Computer Engineering: Hardware Design", "M. Morris Mano", Computer Engineering,  3.77 avg rating — 96 ratings
"Instructor's Solutions Manual To Accompany "Design Of Analog Filters" (The Oxford Series In Electrical & Computer Engineering)", "Rolf Schaumann", Computer Engineering,  4.21 avg rating — 14 ratings
"A guide to get a top 50 rank in JEE!: IIT Bombay, Computer Science and Engineering", "M.E. Van Valkenburg", Computer Engineering,  4.42 avg rating — 36 ratings
"The Beginner's Guide to Engineering: Computer Engineering", "Aman Goel", Computer Engineering,  3.56 avg rating — 16 ratings
"Microelectronic Circuits (Oxford Series in Electrical and Computer Engineering)", "James Lance", Computer Engineering,  4.07 avg rating — 878 ratings
"Essentials of Electrical and Computer Engineering [With Removable Reference Cards]", "Adel S. Sedra", Computer Engineering,  3.42 avg rating — 12 ratings
"Introduction to Electrical and Computer Engineering", "Kenneth C. Smith", Computer Engineering,  4.40 avg rating — 5 ratings
"Solutions Manual Accompanying "Elements Of Electromagnetics" (The Oxford Series In Electrical & Computer Engineering)", "David V. Kerns", Computer Engineering,  3.69 avg rating — 13 ratings
"Marketing Engineering: Computer-Assisted Marketing Analysis and Planning", "J. David Irwin", Computer Engineering,  3.63 avg rating — 27 ratings
"FE Exam Review: Electrical and Computer Engineering", "Charles D. Fledderman", Computer Engineering,  3.20 avg rating — 10 ratings
"Introductory Circuits for Electrical and Computer Engineering", "Martin Bradshaw", Computer Engineering,  3.38 avg rating — 13 ratings
"Digital Principles and Logic Design (Engineering) (Computer Science) (Engineering Series)", "Charles D. Fledderman", Computer Engineering,  3.80 avg rating — 10 ratings
"Fundamentals of data structures (Computer software engineering series)", "Matthew N.O. Sadiku", Computer Engineering,  3.50 avg rating — 14 ratings
"Fundamentals of computer algorithms (Computer software engineering series)", "Jerry Sagliocca", Computer Engineering,  3.85 avg rating — 122 ratings
"Bayesian Methods in the Search for MH370", "Gary L. Lilien", Computer Engineering,  4.14 avg rating — 7 ratings
"Articles on Social Engineering (Computer Security), Including: Trojan Horse (Computing), Advance-Fee Fraud, Scam Baiting, Phishing, Social Engineering (Security), 419eater.Com, Scareware, Lottery Scam, Whitemail, Paypai, Employment Scams", "Arvind Rangaswamy", Computer Engineering,  3.71 avg rating — 7 ratings
"Basic Computer Engineering", "Myron E. Sveum", Computer Engineering,  1.50 avg rating — 2 ratings
"The Computer Engineering Handbook", "James W. Nilsson", Computer Engineering,  3.75 avg rating — 4 ratings
"Sedra/Smith Package #2: Microelectronic Circuits, Fifth Edition And Kc's Problems And Solutions (The Oxford Series In Electrical And Computer Engineering)", "Susan A. Riedel", Computer Engineering,  3.33 avg rating — 6 ratings
"Computer Engineering", "Arijit Saha", Computer Engineering,  3.55 avg rating — 11 ratings
"The Computer Science and Engineering Handbook", "Allen B. Tucker Jr.", Computer Engineering,  3.60 avg rating — 5 ratings
"1999 Alessandro VOLTA Memorial Workshoop on Low Power Design", "Steven M. Bellovin", Computer Engineering,  2.00 avg rating — 1 rating
"The Oxbridge Formula: Get into Oxford & Cambridge for: Maths; Computer Science; Physics; Engineering; Natural Sciences; Economics; PPE... and more!", "IEEE Computer Engineering", Computer Engineering,  4.00 avg rating — 11 ratings
"Sedra/Smith Package #3: Microelectronic Circuits, Fifth Edition; Kc's Problems And Solutions; And Laboratory Explorations (The Oxford Series In Electrical And Computer Engineering)", "Institute of Electrical and Electronics Engineers", Computer Engineering,  3.67 avg rating — 6 ratings
"Fundamental Concepts in Electrical and Computer Engineering with Practical Design Problems", "Paarul Shah", Computer Engineering,  3.50 avg rating — 2 ratings
"Software Engineering (International Computer Science Series)", "Jessica Grindlay", Computer Engineering,  3.78 avg rating — 877 ratings
"Engineering Basics: Electrical, Electronics and Computer Engineering", "Chris Parker", Computer Engineering,  3.40 avg rating — 5 ratings
"17th European Symposium on Computed Aided Process Engineering. Computer Aided Chemical Engineering, Volume 24", "Adel S. Sedra", Computer Engineering,  1.00 avg rating — 1 rating
"Assemblers, compilers, and program translation (Computer software engineering series)", "Kenneth C. Smith", Computer Engineering,  4.25 avg rating — 4 ratings
"Computer engineering: A DEC view of hardware systems design", "Peter M. Meenen III", Computer Engineering,  3.75 avg rating — 4 ratings
"2005 International Conference on Cyberworlds: Cw 2005: [proceedings]: 23-25 November 2005, Singapore", "Reza Adhami", Computer Engineering,  1.00 avg rating — 1 rating
"EMI Filter Design", "Dennis Hite", Computer Engineering,  3.00 avg rating — 4 ratings
"Digital Computer and Control Engineering", "Ian Sommerville", Computer Engineering,  2.00 avg rating — 2 ratings
"Computer Aided Engineering Drawing", "T. Thyagarajan", Computer Engineering,  2.00 avg rating — 1 rating
"Robot Modeling & Kinematics", "Romania European Symposium on Computer Aided Process Engineering (17", Computer Engineering,  2.00 avg rating — 1 rating
"Computer Aided Design, Computer Aided Manufacturing, Computer Aided Engineering for Industrial Progress", "Valentin Plesu", Computer Engineering,  4.40 avg rating — 10 ratings
"FIBER OPTICS AND LASER INSTRUMENTATION:", "Paul Serban Agachi", Computer Engineering,  3.00 avg rating — 3 ratings
"PHP Programming and MySQL For Beginners: A Simple Start To PHP & MySQL (Written By A Software Engineer) (PHP Programming, MySQL, Computer Programming, Software Engineering Book 3)", "Peter Calingaert", Computer Engineering,  4.25 avg rating — 8 ratings
"2001 IEEE ICCV Workshop on Recognition, Analysis, and Tracking", "C. Gordon Bell", Computer Engineering,  2.00 avg rating — 1 rating
"Graph Theory With Applications To Engineering And Computer Science", "J. Craig Mudge", Computer Engineering,  4.05 avg rating — 130 ratings
"PPI FE Electrical and Computer Practice Problems – Comprehensive Practice for the FE Electrical and Computer Fundamentals of Engineering Exam", "Michael R. Lindeburg", Computer Engineering,  3.00 avg rating — 4 ratings
"Computers and Commerce: A Study of Technology and Management at Eckert-Mauchly Computer Company, Engineering Research Associates, and Remington Rand, 1946-1957", "Arthur L. Norberg", Computer Engineering,  3.00 avg rating — 4 ratings
"Encyclopedia of Computer Science and Engineering", "Anthony Ralston", Computer Engineering,  2.00 avg rating — 1 rating
"Computer Aided Engineering Drawing", "Edwin D. Reilly", Computer Engineering,  4.50 avg rating — 8 ratings
"Introduction to Discrete Structures for Computer Science and Engineering", "N.H. Dubey", Computer Engineering,  3.00 avg rating — 3 ratings
"Operation and Modeling of the MOS Transistor: Special MOOC Edition (Oxford Series in Electrical and Computer Engineering)", "Franco P. Preparata", Computer Engineering,  4.08 avg rating — 40 ratings
"Program Translation Fundamentals: Methods and Issues (Computer Software Engineering Series 22)", "Raymond T. Yeh", Computer Engineering,  3.75 avg rating — 4 ratings
"Numerical Methods for Computer Science, Engineering, and Mathematics", "Yannis Tsividis", Computer Engineering,  3.62 avg rating — 8 ratings
"Powerpoint Overheads To Accompany Introduction To Electrical Engineering (The Oxford Series In Electrical And Computer Engineering)", "Colin McAndrew", Computer Engineering,  4.12 avg rating — 8 ratings
"The computer engineering handbook. / Digital systems and applications", "Peter Calingaert", Computer Engineering,  3.00 avg rating — 3 ratings
"Use of Digital Computers for Engineering Applications", "John H. Mathews", Computer Engineering,  1.00 avg rating — 2 ratings
"Introduction to Computer Engineering: Hardware and Software Design", "Mulukutla S. Sarma", Computer Engineering,  2.00 avg rating — 1 rating
"Computer Aided Engineering Drawing (As per the latest BIS standards SP: 46-2003), Revised Third Edition", "Vojin G. Oklobdzija", Computer Engineering,  2.00 avg rating — 1 rating
"Social Engineering (Computer Security): Trojan Horse, Advance-Fee Fraud, Phishing, List of Rogue Security Software, Pranknet", "Charles M. Haberman", Computer Engineering,  2.00 avg rating — 1 rating
"Karnataka M.E./M.Tech. PGCET: Computer Science /IT Engineering", "Taylor L. Booth", Computer Engineering,  3.00 avg rating — 2 ratings
"Pe Sample Questions And Solutions: Electrical And Computer Engineering (Book & Cd Rom)", "S. Trymbaka Murthy", Computer Engineering,  3.50 avg rating — 2 ratings
"Dictionary of Computer Science, Engineering and Technology", "Books LLC", Computer Engineering,  3.00 avg rating — 2 ratings
"Electric Circuits: Study Guide (Addison Wesley Series In Electrical And Computer Engineering)", "Chandresh Agrawal", Computer Engineering,  4.00 avg rating — 1 rating
"Basic Computer Engineering, 2ed", "Nandini Books", Computer Engineering,  0.00 avg rating — 0 ratings
"The Computer Engineering Handbook", "National Council of Examiners for Engineering and Surveying", Computer Engineering,  3.00 avg rating — 2 ratings
"Computer Methods for Engineering with MATLAB(R) Applications", "Yogesh Jaluria", Computer Engineering,  3.25 avg rating — 4 ratings
"Metal Fatigue Analysis Handbook: Practical Problem-Solving Techniques for Computer-Aided Engineering", "Yung-Li Lee", Computer Engineering,  2.50 avg rating — 2 ratings
"TANCET M.E. Computer Science and Engineering and Information Technologies - I", "Mark E. Barkey", Computer Engineering,  3.50 avg rating — 2 ratings
"Computers in Chemical Engineering Education", "Hong-Tae Kang", Computer Engineering,  4.00 avg rating — 3 ratings
"Computer-Aided Engineering Drawing Using AutoCAD", "Amit Gupta", Computer Engineering,  2.00 avg rating — 2 ratings
"Internet of Things for Smart Cities: Technologies, Big Data and Security", "Brice Carnahan", Computer Engineering,  2.00 avg rating — 5 ratings
"Wiley Encyclopedia of Computer Science and Engineering", "Cecil Howard Jensen", Computer Engineering,  3.00 avg rating — 1 rating
"Tancet - Computer Science And Engineering & Information Technology, Engineering mathematics And Basic Engineering Science (3 in 1) Book", "Donald D. Voisinet", Computer Engineering,  3.50 avg rating — 2 ratings
"Continuous and Discrete Signal and System Analysis (H R W Series in Electrical and Computer Engineering)", "Jay D. Helsel", Computer Engineering,  3.62 avg rating — 8 ratings
"Dictionary of Computer Engineering", "Waleed Ejaz", Computer Engineering,  3.00 avg rating — 2 ratings
"Linux for Beginners: A Practical Guide for Complete Beginners on How to Master and Discover Surprisingly Tips On How to Use Linux Efficiently (Computer Engineering Book 2)", "Alagan Anpalagan", Computer Engineering,  2.00 avg rating — 1 rating
"Spin-Up for the Electrical and Computer Engineering PE Exam (Power): Five Sample Exams", "Benjamin W. Wah", Computer Engineering,  3.50 avg rating — 4 ratings
"Smart Technology for Aging, Disability, and Independence: Computer and Engineering Design and Applications", "V.SANTHANA KRISHNAN,S.NIZA DR.ANTONY XAVIER", Computer Engineering,  3.00 avg rating — 1 rating
"Introduction to Computer Engineering: Logic Design and the 8086 Microprocessor (Book/Disk)", "Clare D. McGillem", Computer Engineering,  4.00 avg rating — 2 ratings
"Introduction to Computer Networking for Engineering and Technology", "George R. Cooper", Computer Engineering,  2.50 avg rating — 2 ratings
"PE Electrical and Computer: Computer Engineering Practice Exam", "Engineering Dictionaries", Computer Engineering,  3.00 avg rating — 1 rating
"Computer Software Engineering Research", "John Snowden", Computer Engineering,  3.00 avg rating — 1 rating
"Computer-Aided Engineering Software: Catia, Hydrological Transport Model, Intellicad, Graitec, Hypersizer, Nx, LMS International, Ioso", "Cory Lanza Pe", Computer Engineering,  3.00 avg rating — 1 rating
"Computer Architecture (Addison-Wesley Series in Electrical and Computer Engineering)", "Abdelsalam Helal", Computer Engineering,  4.00 avg rating — 2 ratings
"Communication Systems (McGraw-Hill Series in Electrical & Computer Engineering)", "Mounir Mokhtari", Computer Engineering,  3.82 avg rating — 38 ratings
"Object Oriented Computer Systems Engineering", "Derrick Morris", Computer Engineering,  4.00 avg rating — 4 ratings
"Battery Technology Handbook", "Gareth Evans", Computer Engineering,  2.00 avg rating — 1 rating
"Transmission Lines In Computer Engineering", "Peter Green", Computer Engineering,  3.00 avg rating — 2 ratings
"Mathematics (for Computer Science & Engineering Students) Paper–1: Calculus and Linear Algebra and Paper-2: Probability and Statistics (As per AICTE Model Curriculum 2018)", "H.A. Kiehne", Computer Engineering,  2.67 avg rating — 3 ratings
"Electric Circuits (Addison-Wesley Series in Electrical and Computer Engineering)", "Sol Rosenstark", Computer Engineering,  3.72 avg rating — 232 ratings
"C for Electronics and Computer Engineering Technology", "ITL Education Solutions Limited", Computer Engineering,  3.00 avg rating — 2 ratings
"Engineering Informatics: Fundamentals of Computer-Aided Engineering", "James W. Nilsson", Computer Engineering,  2.00 avg rating — 2 ratings
"Understanding Admissions: Getting into the Top Graduate Schools in Computer Science and Engineering", "Susan A. Riedel", Computer Engineering,  3.00 avg rating — 3 ratings
"Spin-Up for the Electrical and Computer Engineering PE Exam (Power): Five Sample Exams Third Edition", "Peter J. Holsberg", Computer Engineering,  1.00 avg rating — 1 rating
"Powerpoint Overheads To Accompany Linear Circuit Analysis (The Oxford Series In Electrical And Computer Engineering)", "Ian F.C. Smith", Computer Engineering,  3.67 avg rating — 3 ratings
"Computer Engineering Reference Manual for the Electrical and Computer PE Exam", "Benny Raphael", Computer Engineering,  3.00 avg rating — 2 ratings
"Basic Electrical, Electronics and Computer Engineering", "Ryan Lilien", Computer Engineering,  2.00 avg rating — 1 rating
"Algorithms and Data Structures in Computer Engineering", "Ramgopal Mettu", Computer Engineering,  3.00 avg rating — 2 ratings
"Thought Contagion: When Ideas ACT Like Viruses (The Kluwer International Series in Engineering & Computer Science)", "Cory Lanza Pe", Computer Engineering,  3.22 avg rating — 128 ratings
"Computer Engineering", "Raymond A. DeCarlo", Computer Engineering,  2.00 avg rating — 1 rating
"Basic Computer Engineering", "Pen-Min Lin", Computer Engineering,  0.00 avg rating — 0 ratings
"CAED COMPUTER AIDED ENGINEERING DRAWING FOR 1/11 SEMESTER BE/BTECH COURSES (PB 2015)", "John A. Camara", Computer Engineering,  0.00 avg rating — 0 ratings
"Speech Processing And Soft Computing (Springer Briefs In Electrical And Computer Engineering / Springer Briefs In Speech Technology)", "R. Muthusubramanian", Computer Engineering,  3.00 avg rating — 1 rating
"Modern Digital Control Systems", "E. Stewart Lee", Computer Engineering,  4.25 avg rating — 8 ratings
"Matrix Operations and Use of Computers in Structural Engineering", "Aaron Lynch", Computer Engineering,  1.00 avg rating — 1 rating
"Principles Of Electrical Engineering And Electronics", "V.K. Mehta", Electrical Engineering,  3.98 avg rating — 441 ratings
"An Integrated Course in Electrical Engineering (With More Than 15,000 Objective Type Questions & Answers)", "J.B. Gupta", Electrical Engineering,  3.77 avg rating — 449 ratings
"Fundamentals Of Electrical Engineering And Electronics", "B.L. Theraja", Electrical Engineering,  4.09 avg rating — 495 ratings
"Mechatronics: Electronic Control Systems in Mechanical and Electrical Engineering", "W. Bolton", Electrical Engineering,  4.09 avg rating — 480 ratings
"Electrical Engineering Fundamentals", "Vincent Del Toro", Electrical Engineering,  4.15 avg rating — 224 ratings
"Question Bank in Electrical Engineering", "J.B. Gupta", Electrical Engineering,  4.08 avg rating — 204 ratings
"Basic Electrical Engineering", "T.K. Nagsarkar", Electrical Engineering,  4.01 avg rating — 257 ratings
"Explanation/Solutions to An Integrated Course in Electrical Engineering", "J.B.Gupta", Electrical Engineering,  3.52 avg rating — 171 ratings
"Oxford English for Electrical and Mechanical Engineering: Answer Book with Teaching Notes", "Eric H. Glendinning", Electrical Engineering,  4.22 avg rating — 213 ratings
"Fundamentals of Electrical Engineering", "Norman Glendinning", Electrical Engineering,  4.10 avg rating — 247 ratings
"electrical engineering", "Leonard S. Bobrow", Electrical Engineering,  4.20 avg rating — 323 ratings
"ABC of Electrical Engineering", "B.L. Theraja", Electrical Engineering,  4.12 avg rating — 188 ratings
"Basic Electrical Engineering", "B.L. Theraja", Electrical Engineering,  3.47 avg rating — 86 ratings
"Basic Electrical Engineering Revised First Edition", "A.K. Theraja", Electrical Engineering,  3.52 avg rating — 71 ratings
"Basic Electrical and Electronics Engineering", "D.P. Kothari", Electrical Engineering,  4.53 avg rating — 57 ratings
"Elements Of Electrical And Mechanical Engineering", "I.J. Nagrath", Electrical Engineering,  3.93 avg rating — 165 ratings
"Student Solutions Manual for Probability, Statistics, and Random Processes for Electrical Engineering", "D.C. Kulshreshtha", Electrical Engineering,  4.20 avg rating — 60 ratings
"Electrical Engineering", "R. Muthusubramanian", Electrical Engineering,  3.97 avg rating — 59 ratings
"Basic Electrical and Electronics Engineering Book", "B.L. Theraja", Electrical Engineering,  3.99 avg rating — 68 ratings
"Basic Electrical and Electronics Engineering", "Alberto León García", Electrical Engineering,  3.58 avg rating — 50 ratings
"Mechatronics: Electronic Control Systems in Mechanical and Electrical Engineering", "W. Bolton", Electrical Engineering,  4.23 avg rating — 48 ratings
"Electrical Engineering 101: Everything You Should Have Learned in School...but Probably Didn't", "Darren Ashby", Electrical Engineering,  4.01 avg rating — 209 ratings
"Circuit Analysis for Complete Idiots", "David Smith", Electrical Engineering,  4.31 avg rating — 26 ratings
"Instructor's Manual for Fundamentals of Electrical Engineering", "Leonard S. Bobrow", Electrical Engineering,  4.35 avg rating — 57 ratings
"Basic Electrical Engineering", "A.E. Fitzgerald", Electrical Engineering,  3.91 avg rating — 53 ratings
"Fundamentals of Electrical Engineering", "David E. Higginbotham", Electrical Engineering,  4.00 avg rating — 30 ratings
"The Standard Electrical Dictionary A Popular Dictionary of Words and Terms Used in the Practice of Electrical Engineering", "Arvin Grabel", Electrical Engineering,  3.05 avg rating — 131 ratings
"Electrical Engineering: Principles and Applications", "Ashfaq Husain", Electrical Engineering,  3.77 avg rating — 131 ratings
"Objective Electrical Engineering: Study Material with Solved MCQs: With Study Material", "Harroon Ashfaq", Electrical Engineering,  3.81 avg rating — 27 ratings
"Electrical Power Engineering Reference & Applications Handbook", "Thomas O'Conor Sloane", Electrical Engineering,  4.14 avg rating — 43 ratings
"Probability and Random Processes for Electrical Engineering", "Allan R. Hambley", Electrical Engineering,  3.82 avg rating — 38 ratings
"A Course in Electrical Technology: Basic Electrical Engineering - Vol. 1", "R. Gupta", Electrical Engineering,  3.83 avg rating — 18 ratings
"Principles Of Electrical Engineering", "Rajesh Garg", Electrical Engineering,  3.64 avg rating — 25 ratings
"Electromagnetic Theory for Complete Idiots", "K.C. Agrawal", Electrical Engineering,  4.29 avg rating — 14 ratings
"Competency in Marine Electrical Engineering", "Alberto León García", Electrical Engineering,  4.19 avg rating — 16 ratings
"Electrical Engineering Materials", "J.B. Gupta", Electrical Engineering,  4.00 avg rating — 19 ratings
"Instructor's Solutions Manual To Accompany "Design Of Analog Filters" (The Oxford Series In Electrical & Computer Engineering)", "Rohit Mehta", Electrical Engineering,  4.21 avg rating — 14 ratings
"English in Electrical Engineering and Electronics: Teacher's Edition", "David Smith", Electrical Engineering,  4.08 avg rating — 24 ratings
"BASICS OF ELECTRICAL ENGINEERING AND ELECTRONIC COMPONENTS", "J. Majumder", Electrical Engineering,  2.93 avg rating — 15 ratings
"Structure and Interpretation of Computer Programs", "Elstan A. Fernandez", Electrical Engineering,  4.47 avg rating — 4,440 ratings
"Electrical Engineering: by Knowledge flow", "Knowledge flow", Electrical Engineering,  3.89 avg rating — 28 ratings
"Electrical Engineering Drawing-I", "Raj Kumar Jat", Electrical Engineering,  3.61 avg rating — 23 ratings
"A Textbook of Basic Electrical and Electronics Engineering", "Younish Pathan", Electrical Engineering,  3.69 avg rating — 16 ratings
"Control Systems for Complete Idiots", "Surjit Singh", Electrical Engineering,  3.53 avg rating — 19 ratings
"Principles of Electrical Engineering and Electronics", "J.B. Gupta", Electrical Engineering,  4.14 avg rating — 28 ratings
"Probability, Statistics, and Random Processes for Electrical Engineering", "David Smith", Electrical Engineering,  3.59 avg rating — 56 ratings
"Basic Electrical Engineering", "Mehta V.K.", Electrical Engineering,  3.50 avg rating — 22 ratings
"GATE-2014 Electrical Engineering", "Mehta Rohit", Electrical Engineering,  4.17 avg rating — 54 ratings
"Circuits, Devices and Systems: A First Course in Electrical Engineering", "Alberto León García", Electrical Engineering,  3.95 avg rating — 19 ratings
"Electrical and Electronics Engineering Materials", "Rohit Mehta", Electrical Engineering,  3.83 avg rating — 12 ratings
"Implementation of Functional Multiprocessors: Electronic and Electrical Engineering Research", "J.B. Gupta", Electrical Engineering,  0.00 avg rating — 0 ratings
"A Textbook Of Electrical Engineering", "Ralph Judson Smith", Electrical Engineering,  3.84 avg rating — 51 ratings
"Electrical Machine Principles: A Must Have Guide for Students and Professionals (Electrical Engineering Book 1)", "Richard C. Dorf", Electrical Engineering,  3.61 avg rating — 49 ratings
"Principles of Electrical Engineering", "J.B. Gupta", Electrical Engineering,  4.21 avg rating — 19 ratings
"ABC of Electrical Engineering", "O. Boudillet", Electrical Engineering,  4.58 avg rating — 12 ratings
"GATE Electrical Engineering Vol 2 (GATE 2015 EE by R. K. Kanodia 4 Volume Set)", "R.K. Rajput", Electrical Engineering,  4.36 avg rating — 11 ratings
"GATE Electrical Engineering Vol 1 (GATE 2015 EE by R. K. Kanodia 4 Volume Set)", "Ryan Godsell", Electrical Engineering,  3.70 avg rating — 10 ratings
"Principles of Electrical Engineering Materials and Devices", "Vincent Del Toro", Electrical Engineering,  4.00 avg rating — 59 ratings
"Basic Concepts of Electrical Engineering", "Jain", Electrical Engineering,  3.92 avg rating — 12 ratings
"Electrical Engineering Sampler: Baker, Li, Ott, Kossiakoff, Holma, Jakobsson, Burton", "R.K. Kanodia", Electrical Engineering,  4.04 avg rating — 28 ratings
"Microelectronic Circuits (Oxford Series in Electrical and Computer Engineering)", "Adel S. Sedra", Electrical Engineering,  4.07 avg rating — 878 ratings
"Electrical Engineering: Solutions Manual", "Kenneth C. Smith", Electrical Engineering,  4.69 avg rating — 13 ratings
"Electrical Engineering: A Pocket Reference", "Allan R. Hambley", Electrical Engineering,  3.82 avg rating — 11 ratings
"Basic Electrical Engineering", "Heinz Schmidt-Walter", Electrical Engineering,  4.19 avg rating — 16 ratings
"Fundamentals of Electrical and Electronics Engineering", "C.L. Wadhwa", Electrical Engineering,  4.08 avg rating — 13 ratings
"Collected Tesla Writings; Scientific Papers and Articles by Tesla and Others about Tesla's Work Primarily in the Field of Electrical Engineering", "Smarajit Ghosh", Electrical Engineering,  4.38 avg rating — 8 ratings
"Electrical Transformers: A Top Graded Study for Students and Professionals (Electrical Engineering Book 2)", "Nikola Tesla", Electrical Engineering,  3.31 avg rating — 26 ratings
"Essentials of Electrical and Computer Engineering [With Removable Reference Cards]", "Ryan Godsell", Electrical Engineering,  3.42 avg rating — 12 ratings
"Principles and Applications of Electrical Engineering", "David V. Kerns", Electrical Engineering,  3.07 avg rating — 28 ratings
"3500 MCQs: Electrical Engineering - Practice Book for ESE, GATE & PSUs", "J. David Irwin", Electrical Engineering,  3.64 avg rating — 14 ratings
"Basic Electrical and Electronics Engineering", "Giorgio Rizzoni", Electrical Engineering,  3.33 avg rating — 9 ratings
"Solutions Manual Accompanying "Elements Of Electromagnetics" (The Oxford Series In Electrical & Computer Engineering)", "Made Easy Editorial Board", Electrical Engineering,  3.69 avg rating — 13 ratings
"Pocket Book of Electrical Engineering Formulas", "P.V. Prasad", Electrical Engineering,  3.92 avg rating — 12 ratings
"Introduction to Electrical and Computer Engineering", "R. Prasad", Electrical Engineering,  4.40 avg rating — 5 ratings
"Fundamentals of Electrical Engineering", "S. Sivanagaraju", Electrical Engineering,  3.25 avg rating — 8 ratings
"Solutions Manual To Accompany Engineering Electromagnetics", "Matthew N.O. Sadiku", Electrical Engineering,  4.13 avg rating — 15 ratings
