"Engineering Electromagnetics with CD (McGraw-Hill Series in Electrical Engineering)", "Jerry Sagliocca", Electrical Engineering,  3.80 avg rating — 170 ratings
"Electrical Engineering: Know It All", "Richard C. Dorf", Electrical Engineering,  4.06 avg rating — 17 ratings
"Electrical Engineering 101", "Charles D. Fledderman", Electrical Engineering,  3.53 avg rating — 17 ratings
"Fundamentals of Electrical Engineering and Technology", "Martin Bradshaw", Electrical Engineering,  4.18 avg rating — 11 ratings
"Electrical Engineering Interview Questions and Answers (1000 + Important Questions)", "Rahul Nigam", Electrical Engineering,  3.75 avg rating — 4 ratings
"Electricity Power Systems: A Comprehensive Guide for Students and Professionals (Electrical Engineering Book 3)", "Ryan Godsell", Electrical Engineering,  3.06 avg rating — 31 ratings
"Arduino for Complete Idiots", "David Smith", Electrical Engineering,  4.27 avg rating — 11 ratings
"Basic Electrical and Electronics Engineering", "B.R. Patil", Electrical Engineering,  4.33 avg rating — 3 ratings
"The Electrical Engineering Handbook", "Richard C. Dorf", Electrical Engineering,  4.15 avg rating — 13 ratings
"Basic Electrical Engineering", "SK Sahdev", Electrical Engineering,  3.62 avg rating — 8 ratings
"Baby Loves Electrical Engineering on Christmas!", "Ruth Spiro", Electrical Engineering,  4.08 avg rating — 40 ratings
"Magnetic Circuits and Transformers: A First Course For Power & Communication Engineers", "Irene Chan", Electrical Engineering,  3.75 avg rating — 4 ratings
"Basics of Electrical Engineering", "Mit Electrical Engineering Service", Electrical Engineering,  3.70 avg rating — 10 ratings
"Circuits, Devices and Systems: A First Course in Electrical Engineering", "Sanjeev Sharma", Electrical Engineering,  4.50 avg rating — 6 ratings
"Transmission and Distribution Electrical Engineering", "Ralph Judson Smith", Electrical Engineering,  4.44 avg rating — 9 ratings
"Schaum's Outline of Basic Electrical Engineering", "Colin Bayliss", Electrical Engineering,  3.00 avg rating — 15 ratings
"Basic Electrical Engineering", "Brian Hardy", Electrical Engineering,  3.50 avg rating — 2 ratings
"Basic Electrical and Electronics Engineering", "Jimmie J. Cathey", Electrical Engineering,  4.33 avg rating — 3 ratings
"Basic Electrical Engineering", "Anwani", Electrical Engineering,  4.27 avg rating — 11 ratings
"FE Exam Review: Electrical and Computer Engineering", "R.K. Rajput", Electrical Engineering,  3.20 avg rating — 10 ratings
"Instrumentation and Measurement in Electrical Engineering", "S.N. Singh", Electrical Engineering,  4.67 avg rating — 3 ratings
"CONCEPTS OF ELECTRICAL AND ELECTRONICS ENGINEERING", "Myron E. Sveum", Electrical Engineering,  4.75 avg rating — 8 ratings
"Electrical Engineering Circuits", "Roman Malaric", Electrical Engineering,  4.20 avg rating — 5 ratings
"Introduction to Electrical Engineering", "K. Shashidhar", Electrical Engineering,  3.44 avg rating — 9 ratings
"Civil Engineering: Conventional and Objective Type (2018-19 Session)", "R.S. Khurmi", Civil Engineering,  3.61 avg rating — 203 ratings
"Civil Engineering: Objective Type and Conventional Questions and Answers", "J.K. Gupta", Civil Engineering,  4.01 avg rating — 144 ratings
"Estimating,Costing,Specification & Valuation In Civil Engineering", "R.Agor", Civil Engineering,  3.53 avg rating — 140 ratings
"Estimating And Costing in Civil Engineering", "M Chakraborti", Civil Engineering,  3.89 avg rating — 73 ratings
"Civil Engineering Formulas", "B.N. Dutta", Civil Engineering,  4.18 avg rating — 95 ratings
"Question Bank in Civil Engineering", "Tyler G. Hicks", Civil Engineering,  3.66 avg rating — 70 ratings
"The Civil Engineering Handbook", "V.S. Murthy", Civil Engineering,  4.07 avg rating — 74 ratings
"Civil Engineering: A Very Short Introduction", "R. Sood", Civil Engineering,  3.57 avg rating — 114 ratings
"Civil Engineering Reference Manual for the PE Exam", "Wai-Fah Chen", Civil Engineering,  4.10 avg rating — 196 ratings
"Irrigation Engineering And Hydraulic Structures ; For [Civil Engineering Degree Students:  Amie (Section B) Exams New Scheme:  U.P.S.C. And Other State Service Competitions:  And For Professionals]", "J.Y. Richard Liew", Civil Engineering,  3.64 avg rating — 50 ratings
"Construction Methods for Civil Engineering", "David Muir Wood", Civil Engineering,  4.02 avg rating — 50 ratings
"Civil Engineering Materials", "Michael R. Lindeburg", Civil Engineering,  3.66 avg rating — 41 ratings
"Construction Materials for Civil Engineering", "Santosh Kumar Garg", Civil Engineering,  4.00 avg rating — 36 ratings
"Objectives in Civil Engineering", "Errol Van Amsterdam", Civil Engineering,  3.15 avg rating — 26 ratings
"A Course in Civil Engineering Drawing", "Shan Somayaji", Civil Engineering,  3.19 avg rating — 27 ratings
"Made Easy - A Handbook on Civil Engineering", "Shan Somayji", Civil Engineering,  4.22 avg rating — 32 ratings
"Civil Engineering: Objective Type For Degree Classes And For G.A.T.E. Page Ii", "Errol Van Amsterdam", Civil Engineering,  4.25 avg rating — 12 ratings
"Estimating and Costing in Civil Engineering: Theory and Practice Including Specifications and Valuation", "V.S. Murthy", Civil Engineering,  4.31 avg rating — 26 ratings
"Elements of Civil Engineering and Engineering Mechanics", "R. Sood", Civil Engineering,  3.94 avg rating — 16 ratings
"Civil Engineering Contracts and Estimates, Edition IV", "V.B. Sikka", Civil Engineering,  3.94 avg rating — 17 ratings
"Handbook of Civil Engineering Calculations (McGraw-Hill Handbooks)", "Tyler G. Hicks", Civil Engineering,  4.24 avg rating — 34 ratings
"Civil Engineering PE Exam Secrets Study Guide: Civil Engineering Pe Test Review for the Principles and Practice of Engineering - Civil Engineering Exam", "Civil Engineering PE Exam Secrets Test Prep Team", Civil Engineering,  3.67 avg rating — 3 ratings
"Civil Engineering MCQ Book: Civil Engineering Multiple Choice Questions ebook", "Objective Books", Civil Engineering,  3.76 avg rating — 17 ratings
"Civil Engineering: Through Objective Type Questions", "S.P. Gupta", Civil Engineering,  4.23 avg rating — 43 ratings
"Objective Type and Conventional Questions and Answers on Civil Engineering for All Types of Examinations & Interviews", "S.S. Gupta", Civil Engineering,  4.12 avg rating — 25 ratings
"Death of an Apprentice: a life in and out of Civil Engineering", "R. Agor", Civil Engineering,  3.00 avg rating — 3 ratings
"Structural Dynamics (Prentice-Hall International Series in Civil Engineering and Engineering M)", "Andrew G. Szava-Kovats", Civil Engineering,  4.11 avg rating — 28 ratings
"Civil Engineering 5800 + MCQs Practice Book for SSC-JE , Assistant Engineer & Junior Engineer", "Anil K. Chopra", Civil Engineering,  3.22 avg rating — 9 ratings
"Probability Concepts in Engineering: Emphasis on Applications to Civil and Environmental Engineering, 2e Instructor Site", "Engineers Academy Publications", Civil Engineering,  3.94 avg rating — 17 ratings
"Civil & Structural Engineering: Seismic Design of Buildings & Bridges", "Alfredo H. Ang", Civil Engineering,  4.38 avg rating — 13 ratings
"Building And Civil Engineering Claims In Perspective", "Alan       Williams", Civil Engineering,  4.14 avg rating — 7 ratings
"Civil Engineering Quantities", "Geoffrey Arthur Hughes", Civil Engineering,  4.41 avg rating — 17 ratings
"Civil Engineering: Geotechnical Engineering:  An Ideal Review For The Breath/Depth Exam (Civil Engineering", "Ivor H. Seeley", Civil Engineering,  4.31 avg rating — 26 ratings
"Machu Picchu: A Civil Engineering Marvel", "Braja M. Das", Civil Engineering,  3.96 avg rating — 25 ratings
"Civil Engineering FE Exam Preparation Workbook", "Kenneth R. Wright", Civil Engineering,  3.82 avg rating — 17 ratings
"Civil Engineering Materials", "Ruth M. Wright", Civil Engineering,  4.70 avg rating — 20 ratings
"The Science and Technology of Civil Engineering Materials", "Alfredo Valencia Zegarra", Civil Engineering,  4.50 avg rating — 10 ratings
"Drawing for Civil Engineering", "Mo Iqbal", Civil Engineering,  4.18 avg rating — 11 ratings
"Estimating and Costing in Civil Engineering: Theory and Practice Including Specifications and Valuations", "Ali Iqbal", Civil Engineering,  4.67 avg rating — 6 ratings
"Penguin Dictionary of Civil Engineering", "Parbin Singh", Civil Engineering,  4.50 avg rating — 18 ratings
"Handbook of Civil Engineering", "GKP", Civil Engineering,  1.50 avg rating — 2 ratings
"SSC-JE 2019 Civil Engineering Previous Years Topicwise Objective Detailed Solution with Theory", "IES Master Team", Civil Engineering,  4.00 avg rating — 5 ratings
"Elements of Civil Engineering & Engineering Mechanics Semester - I / II for VTU", "Sawant H. J.", Civil Engineering,  5.00 avg rating — 6 ratings
"Civil Engineering PE All-In-One Exam Guide: Breadth and Depth", "Indranil Goswami", Civil Engineering,  3.82 avg rating — 11 ratings
"Practice Problems for the Civil Engineering PE Exam: A Companion to the Civil Engineering Reference Manual", "Michael R. Lindeburg", Civil Engineering,  3.86 avg rating — 37 ratings
"Failure Case Studies in Civil Engineering: Structures, Foundations, and the Geoenvironment", "Paula A. Bosela", Civil Engineering,  3.83 avg rating — 6 ratings
"Lighting Design Handbook", "Pamalee Brady", Civil Engineering,  3.25 avg rating — 4 ratings
"Estimating and Costing in Civil Engineering", "Norbert J. Delatte", Civil Engineering,  4.50 avg rating — 8 ratings
"Ese- 2020 civil engineering topicwise solved paper 1", "Engineerin Civil Engineering Laboratory", Civil Engineering,  3.50 avg rating — 6 ratings
"Comprehensive Basic Civil Engineering", "S. Navy U. S. Navy", Civil Engineering,  4.33 avg rating — 6 ratings
"Civil Engineering", "Dutta B N", Civil Engineering,  3.67 avg rating — 9 ratings
"Statistics in Civil Engineering", "IES Master Team", Civil Engineering,  3.67 avg rating — 6 ratings
"Civil Engineering Solved Problems", "Ashok Kumar Jain", Civil Engineering,  4.22 avg rating — 9 ratings
"Ente Concrete Chinthakal: Essays on Civil Engineering", "Anil K. Jain", Civil Engineering,  4.45 avg rating — 33 ratings
"Civil Engineering: Transportation Engineering Review", "WAGmob", Civil Engineering,  4.33 avg rating — 9 ratings
"The New Penguin Dictionary of Civil Engineering", "Andrew V. Metcalfe", Civil Engineering,  4.20 avg rating — 15 ratings
"Civil Engineering Drawing", "Michael R. Lindeburg", Civil Engineering,  4.00 avg rating — 7 ratings
"Civil Engineering For Objective Type Questions & Answers", "Ranjith Kannankattil", Civil Engineering,  3.00 avg rating — 5 ratings
"Civil Engineering Objective Type Questions", "James H. Banks", Civil Engineering,  4.00 avg rating — 3 ratings
"Construction and Civil Engineering Companies by Country: Construction and Civil Engineering Companies of Australia", "Robert W. Stokes", Civil Engineering,  4.43 avg rating — 7 ratings
"SSC-JE MAINS EXAM CIVIL ENGINEERING SUBJECTWISE CONVENTIONAL SOLVED PAPERS 13 YEARS SOLUTION", "IES Master Publication", Civil Engineering,  3.00 avg rating — 6 ratings
"Objective Civil Engineering", "R. Gupta", Civil Engineering,  3.38 avg rating — 8 ratings
"Civil Engineering Body of Knowledge: Preparing the Future Civil Engineer, Third Edition", "Rajesh Garg", Civil Engineering,  0.00 avg rating — 0 ratings
"Civil Engineering PE Exam Secrets Study Guide: Civil Engineering PE Test Review for the Principles and Practice of Engineering - Civil Engineering Exam", "Civil Engineering Body of Knowledge 3 Task Committee", Civil Engineering,  0.00 avg rating — 0 ratings
"Civil Engineering Construction", "Civil Engineering PE Exam Secrets Test Prep Team", Civil Engineering,  4.40 avg rating — 5 ratings
"Quick Reference for the Civil Engineering PE Exam", "James M. Antill", Civil Engineering,  4.06 avg rating — 17 ratings
"VTU Elements of Civil Engineering & Mechanics", "W.S. Ryan", Civil Engineering,  3.75 avg rating — 4 ratings
"Construction Industry Research Prospectuses For The 21st Century: Engineering And Construction For Sustainable Development: Technical Report", "Michael R. Lindeburg", Civil Engineering,  0.00 avg rating — 0 ratings
"Estimating for Building & Civil Engineering Work", "S.P. Nitsure", Civil Engineering,  5.00 avg rating — 2 ratings
"Don't Throw This Away!: The Civil Engineering Life", "H.J. Sawant", Civil Engineering,  3.38 avg rating — 16 ratings
"Science and Civilisation in China, Volume 4: Physics and physical technology, Part 3: Civil engineering and nautics", "Civil Engineering Research Foundation", Civil Engineering,  5.00 avg rating — 3 ratings
"Civil Engineering Specification", "Butterworth-Heinemann", Civil Engineering,  4.27 avg rating — 11 ratings
"Civil Engineering Estimating Costing & Valuation", "Spence Geddes", Civil Engineering,  3.83 avg rating — 6 ratings
"Cesmm4: Civil Engineering Standard Method of Measurement", "Brian Brenner", Civil Engineering,  4.62 avg rating — 8 ratings
"CIVIL ENGINEERING (UPPSC AE): UPPSC ASSISTANT ENGINEER (20200102 Book 530)", "Joseph Needham", Civil Engineering,  2.50 avg rating — 4 ratings
"Hydraulics in Civil and Environmental Engineering", "Ivor H. Seeley", Civil Engineering,  3.64 avg rating — 11 ratings
"Civil Engineering Materials And Their Testing", "V.N. Vazirani", Civil Engineering,  4.00 avg rating — 3 ratings
"Civil Engineering Materials", "Institution of Civil Engineers", Civil Engineering,  3.00 avg rating — 3 ratings
"Basic Civil Engineering", "YCT EXPERT TEAM", Civil Engineering,  3.50 avg rating — 2 ratings
"Basic Civil And Environmental Engineering", "Andrew Chadwick", Civil Engineering,  3.00 avg rating — 3 ratings
"Introduction to Infrastructure: An Introduction to Civil and Environmental Engineering", "Michael R. Penn", Civil Engineering,  4.33 avg rating — 3 ratings
"A History of Civil Engineering: An Outline from Ancient to Modern Times", "Philip J. Parker", Civil Engineering,  3.86 avg rating — 7 ratings
"Civil Engineering", "Hans Straub", Civil Engineering,  3.25 avg rating — 8 ratings
"Geo Engineering: A Vision For The 21st Century", "P. Jaya Rami Reddy", Civil Engineering,  3.00 avg rating — 1 rating
"A Dictionary of Construction, Surveying and Civil Engineering", "Civil Engineering Research Foundation", Civil Engineering,  4.20 avg rating — 10 ratings
"Civil Engineering Pe Practice Exams: Breadth and Depth", "Christopher Gorse", Civil Engineering,  3.89 avg rating — 9 ratings
"Cesmm3 Civil Engineering Standard Method of Measurement", "David Johnston", Civil Engineering,  3.83 avg rating — 6 ratings
"Civil Engineering: Engineering Economics", "Martin Pritchard", Civil Engineering,  3.67 avg rating — 6 ratings
"Civil Engineering Hydraulics: Essential Theory with Worked Examples", "Indranil Goswami", Civil Engineering,  4.40 avg rating — 5 ratings
"Basic Civil Engineering", "Institution of Civil Engineers", Civil Engineering,  3.40 avg rating — 5 ratings
"The Language Of Civil Engineering In English", "Donald G. Newnan", Civil Engineering,  4.33 avg rating — 3 ratings
"Basic knowledge in civil engineering: Book of 59 topics including history of civil engineering", "C. Nalluri", Civil Engineering,  3.44 avg rating — 9 ratings
"Civil Engineering Project Management", "Agatha Featherstone", Civil Engineering,  1.00 avg rating — 1 rating
"Estimating for Building and Civil Engineering Works", "Martin  Marriott", Civil Engineering,  4.50 avg rating — 2 ratings
"Civil Engineering", "Satheesh Gopi", Civil Engineering,  3.00 avg rating — 2 ratings
"A Textbook on Elements of Civil Engineering and Mechanics", "Eugene J. Hall", Civil Engineering,  3.00 avg rating — 3 ratings
"Civil Engineering Drawing and Design", "Narasimha Vavilala", Civil Engineering,  5.00 avg rating — 1 rating
"Dictionary of Civil Engineering", "Alan C. Twort", Civil Engineering,  4.16 avg rating — 116 ratings
"Elements of Civil Engineering and Engineering Mechanics", "Spence Geddes", Civil Engineering,  3.00 avg rating — 1 rating
"Civil Engineering Contractual Procedures", "Knowledge flow", Civil Engineering,  5.00 avg rating — 1 rating
"Mechatronics: Electronic Control Systems in Mechanical and Electrical Engineering", "W. Bolton", Mechanical Engineering,  4.09 avg rating — 480 ratings
"Oxford English for Electrical and Mechanical Engineering: Answer Book with Teaching Notes", "Eric H. Glendinning", Mechanical Engineering,  4.22 avg rating — 213 ratings
"Mechanical Engineering Design", "Norman Glendinning", Mechanical Engineering,  4.21 avg rating — 291 ratings
"Shigley's Mechanical Engineering Design", "Joseph Edward Shigley", Mechanical Engineering,  4.02 avg rating — 344 ratings
"Mechanical Engineering Objective", "Richard G. Budynas", Mechanical Engineering,  3.71 avg rating — 55 ratings
"Elements Of Electrical And Mechanical Engineering", "Richard G. Budynas", Mechanical Engineering,  3.93 avg rating — 165 ratings
"Solutions Manual For Fundamentals Of Machining And Machine Tools, Third Edition", "J. Keith Nisbett", Mechanical Engineering,  4.19 avg rating — 64 ratings
"Mechatronics: Electronic Control Systems in Mechanical and Electrical Engineering", "R.K. Jain", Mechanical Engineering,  4.23 avg rating — 48 ratings
"2000 Solved Problems in Mechanical Engineering Thermodynamics", "B.L. Theraja", Mechanical Engineering,  4.04 avg rating — 23 ratings
"GATE in 75 Days Mechanical Engineering", "Geoffrey Boothroyd", Mechanical Engineering,  4.13 avg rating — 23 ratings
"Mechanical Engineering Reference Manual for the PE Exam", "W. Bolton", Mechanical Engineering,  4.22 avg rating — 121 ratings
"Elements of Mechanical Engineering", "P.E. Liley", Mechanical Engineering,  3.95 avg rating — 22 ratings
"Mechanical Engineering Objective Type", "Marut Tiwari", Mechanical Engineering,  3.83 avg rating — 18 ratings
"Fundamentals Of Mechanical Engineering: Multiple Choice Questions", "Michael R. Lindeburg", Mechanical Engineering,  3.60 avg rating — 15 ratings
"Fundamentals Of Mechanical Engineering: Thermodynamics, Mechanics And Strength Of Materials", "A. Bala Suadhakar", Mechanical Engineering,  3.33 avg rating — 15 ratings
"Mechanical Engineering Principles", "A.R. Lsrani", Mechanical Engineering,  4.12 avg rating — 40 ratings
"Basics of Mechanical Engineering", "S.M. Bhatt", Mechanical Engineering,  4.25 avg rating — 12 ratings
"Mechanics of Composite Materials (Mechanical and Aerospace Engineering Series)", "D.Handa & H.B.Keswani", Mechanical Engineering,  4.17 avg rating — 30 ratings
"English in Mechanical Engineering: Teacher's Edition", "L.N. Mishra", Mechanical Engineering,  3.56 avg rating — 18 ratings
"Mechanical Engineering for Makers: A Hands-on Guide to Designing and Making Physical Things", "G.S. Sawhney", Mechanical Engineering,  4.44 avg rating — 16 ratings
"Mechanical Engineering for competitions", "R.K Jain", Mechanical Engineering,  3.74 avg rating — 19 ratings
"Basic Mechanical Engineering", "R.K. Rajput", Mechanical Engineering,  3.60 avg rating — 5 ratings
"Mechanical Engineering Handbook", "Research & Education Association", Mechanical Engineering,  3.93 avg rating — 15 ratings
"SSC JE: Mechanical Engineering - Topicwise Previous Solved Papers", "Made Easy Editorial Board", Mechanical Engineering,  3.33 avg rating — 9 ratings
"Finite Element Methods for 6th Sem (Mechanical Engineering) PB", "Halesh S B", Mechanical Engineering,  3.50 avg rating — 4 ratings
"Basic Mechanical Engineering", "R.L. Timings", Mechanical Engineering,  4.17 avg rating — 6 ratings
"Fundamentals of Mechanical Engineering: Thermodynamics, Mechanics, Theory of Machines and Strength of Materials", "G.S. Sawhney", Mechanical Engineering,  4.22 avg rating — 9 ratings
"Science and Civilisation in China, Volume 4: Physics and Physical Technology, Part 2: Mechanical Engineering", "Joseph Needham", Mechanical Engineering,  4.38 avg rating — 8 ratings
"Mechanical Engineering Handbook: For The Engineers", "C. Cullen", Mechanical Engineering,  4.14 avg rating — 7 ratings
"Mechanical Engineering Science", "Navy Feroz", Mechanical Engineering,  4.50 avg rating — 2 ratings
"Mechanical Engineering Objective Type Q And A", "Hannah Hillier", Mechanical Engineering,  3.50 avg rating — 6 ratings
"Practice Problems for the Mechanical Engineering PE Exam: : A Companion to the Mechanical Engineering Reference Manual", "Om Prakash Gupta", Mechanical Engineering,  4.44 avg rating — 41 ratings
"Hand Book of Mechanical Engineering", "Michael R. Lindeburg", Mechanical Engineering,  4.06 avg rating — 16 ratings
"Solutions Manual   Maintenance Replacement And Reliability", "Sadhu Singh", Mechanical Engineering,  4.25 avg rating — 4 ratings
"Mechanical Engineering 101", "Andrew K.S. Jardine", Mechanical Engineering,  3.57 avg rating — 30 ratings
"Elements Of Mechanical Engineering", "WAGmob", Mechanical Engineering,  3.44 avg rating — 9 ratings
"Solving Mechanical Engineering Problems with Matlab", "J.R. Mehta", Mechanical Engineering,  4.17 avg rating — 6 ratings
"The Language Of Mechanical Engineering In English", "Simin Nasseri", Mechanical Engineering,  4.00 avg rating — 11 ratings
"Mechanical Engineering", "Eugene J. Hall", Mechanical Engineering,  4.08 avg rating — 12 ratings
"Mechanical Engineering for Competitions", "D.S. Kumar", Mechanical Engineering,  3.79 avg rating — 14 ratings
"Basic Mechanical Engineering", "Basant Agrawal", Mechanical Engineering,  3.25 avg rating — 4 ratings
"Mechanical Engineering", "C.M. Agrawal", Mechanical Engineering,  4.13 avg rating — 23 ratings
"Heat Pipe Science And Technology (Mechanical Engineering", "R.K. Bansal", Mechanical Engineering,  4.25 avg rating — 4 ratings
"Technical Interview E-Book Mechanical Engineering: Interview Questions and Answers", "Amir Faghri", Mechanical Engineering,  3.80 avg rating — 10 ratings
"Textbook of Elements of Mechanical Engineering", "Objective Books", Mechanical Engineering,  2.00 avg rating — 1 rating
"A History Of Mechanical Engineering", "S. Trymbaka Murthy", Mechanical Engineering,  4.00 avg rating — 7 ratings
"Solutions manual to accompany 'Mechanical engineering design'", "Aubrey F. Burstall", Mechanical Engineering,  4.27 avg rating — 15 ratings
"Mechanical Engineering 101: The TextVook", "Joseph Edward Shigley", Mechanical Engineering,  2.22 avg rating — 9 ratings
"A Handbook for Mechanical Engineering", "Vook", Mechanical Engineering,  4.02 avg rating — 43 ratings
"Mechanical Engineering 4200 + MCQs Practice Book for RRB-JE, SSC-JE , BPSC-AE, UPSSSC-JE,DMRC, ISRO , Metro Exams, Assistant Engineer Exams & Junior Engineer Exams", "ME Team", Mechanical Engineering,  3.00 avg rating — 4 ratings
"MECHANICAL ENGINEERING (UPPSC/STATE PSC/PSU/IES-AE): UPPSC/STATE PSC/PSU/IES-AE (20200326 Book 634)", "Engineers Academy Publications", Mechanical Engineering,  3.14 avg rating — 7 ratings
"Mechanical Engineering", "YCT EXPERT TEAM", Mechanical Engineering,  4.16 avg rating — 19 ratings
"Engineering Considerations Of Stress, Strain, And Strength (Mcgraw Hill Series In Mechanical Engineering)", "Joyeeta Gupta", Mechanical Engineering,  4.00 avg rating — 6 ratings
"The Beginner's Guide to Engineering: Mechanical Engineering", "Robert C. Juvinall", Mechanical Engineering,  2.50 avg rating — 4 ratings
"Dictionary Of Mechanical Engineering", "Mark Huber", Mechanical Engineering,  3.50 avg rating — 6 ratings
"Mechanical Engineering Science", "G.H.F. Nayler", Mechanical Engineering,  4.67 avg rating — 9 ratings
"Mechanical Engineering: Mechanical Engineering", "John Hannah", Mechanical Engineering,  3.40 avg rating — 10 ratings
"An Introduction to Mechanical Engineering", "M.J. Hillier", Mechanical Engineering,  3.33 avg rating — 9 ratings
"Technical English - Mechanical Engineering", "Mahi", Mechanical Engineering,  5.00 avg rating — 1 rating
"DRDO, ISRO : Previous Solved Papers : Mechanical Engineering", "Jonathan Wickert", Mechanical Engineering,  4.33 avg rating — 3 ratings
"An Introduction to Mechanical Engineering Part 1", "Michael  Clifford", Mechanical Engineering,  3.75 avg rating — 12 ratings
"Mechanical Alloying And Milling (Mechanical Engineering", "Kathy Simmons", Mechanical Engineering,  4.20 avg rating — 5 ratings
"Elements of Mechanical Engineering", "Philip Shipway", Mechanical Engineering,  4.50 avg rating — 2 ratings
"5200 Fully Solved MCQ for IES, GATE & PSUs: Mechanical Engineering", "Cury Suryanarayana", Mechanical Engineering,  3.00 avg rating — 5 ratings
"Elements of Mechanical Engineering", "V.K. Manglik", Mechanical Engineering,  4.22 avg rating — 9 ratings
"Design of Machinery with Student Resource DVD (McGraw-Hill Series in Mechanical Engineering)", "B. Singh", Mechanical Engineering,  4.07 avg rating — 68 ratings
"Steam Plant Calculations Manual", "Made Easy Team", Mechanical Engineering,  4.12 avg rating — 8 ratings
"GATE Mechanical Engineering 2016", "D.S. Kumar", Mechanical Engineering,  4.07 avg rating — 15 ratings
"Turbomachinery (Mechanical Engineering", "Robert L. Norton", Mechanical Engineering,  3.25 avg rating — 4 ratings
"Mechanical Engineering MCQ For ESE, GATE, PSUs", "V. Ganapathy", Mechanical Engineering,  3.88 avg rating — 8 ratings
"Shigley's Mechanical Engineering Design, in SI Units", "GKP", Mechanical Engineering,  4.67 avg rating — 12 ratings
"Heating and Cooling of Buildings: Design for Efficiency (McGraw-Hill Series in Mechanical Engineering)", "Earl Logan Jr.", Mechanical Engineering,  4.27 avg rating — 15 ratings
