"Debunking Economics: The Naked Emperor of the Social Sciences", "Horace Miner", Social Science,  4.05 avg rating — 735 ratings
"Social Science: An Introduction to the Study of Society", "Chava Frankfort-Nachmias", Social Science,  3.85 avg rating — 41 ratings
"Methods of Discovery: Heuristics for the Social Sciences", "David Nachmias", Social Science,  3.99 avg rating — 99 ratings
"Student Solutions Manual for Use with Applied Calculus for Business, Economics, and the Social and Life Sciences, Expanded 8th Edition", "Benito Mussolini", Social Science,  3.81 avg rating — 21 ratings
"Open the Social Sciences: Report of the Gulbenkian Commission on the Restructuring of the Social Sciences", "Richard Washburn Child", Social Science,  3.75 avg rating — 278 ratings
"A Textbook of English for Engineers and Technologists", "Humanities And Social Sciences Division - Anna University - Chennai.", Social Science,  0.00 avg rating — 0 ratings
"Integrated Social Science 8", "R.K. Jain", Social Science,  4.00 avg rating — 18 ratings
"Qualitative Research Methods for the Social Sciences", "Advisory Board for History", Social Science,  3.59 avg rating — 145 ratings
"Resolving Social Conflicts and Field Theory in Social Science", "Social", Social Science,  3.94 avg rating — 35 ratings
"The Warcraft Civilization: Social Science in a Virtual World", "Bruce L. Berg", Social Science,  3.01 avg rating — 84 ratings
"Exploring Humans: an Introduction to the Philosophy of the Social Sciences", "Kurt Lewin", Social Science,  3.92 avg rating — 86 ratings
"Social Sciences as Sorcery", "William Sims Bainbridge", Social Science,  4.17 avg rating — 53 ratings
"Super 20 Sample Papers Class 10 Mathematics, Science and Social Science for March 2019 Exam (Set of 3 Books)", "Hans Dooremalen", Social Science,  4.14 avg rating — 21 ratings
"From Economics Imperialism to Freakonomics: The Shifting Boundaries between Economics and other Social Sciences (Economics as Social Theory)", "Herman de Regt", Social Science,  4.06 avg rating — 18 ratings
"Student Solutions Manual for Introductory Mathematical Analysis for Business: Economics and the Life and Social Sciences", "Maurice Schouten", Social Science,  4.25 avg rating — 24 ratings
"Contemporary Philosophy of Social Science", "Stanislav Andreski", Social Science,  3.67 avg rating — 139 ratings
"Poverty Knowledge: Social Science, Social Policy, and the Poor in Twentieth-Century U.S. History", "Team of Experience Authors", Social Science,  4.02 avg rating — 62 ratings
"Xam Idea Complete Series Social Science for CBSE Class 9 (For 2019 Exam)", "Ben Fine", Social Science,  3.93 avg rating — 41 ratings
"Writing Literature Reviews: A Guide for Students of the Social and Behavioral Sciences", "Dimitris Milonakis", Social Science,  3.65 avg rating — 232 ratings
"All in One Social Science Class 9th", "Ernest F. Haeussler Jr.", Social Science,  3.78 avg rating — 37 ratings
"MBD Sure Shot CBSE Sample Papers Social Science Class-10", "Richard S. Paul", Social Science,  2.60 avg rating — 20 ratings
"The Business of People: The significance of social science over the next decade", "Brian Fay", Social Science,  3.67 avg rating — 3 ratings
"Philosophy of Social Science", "Alice O'Connor", Social Science,  3.36 avg rating — 91 ratings
"Asabiyyah: What Ibn Khaldun, the Islamic father of social science, can teach us about the world today", "Panel of Experts", Social Science,  4.21 avg rating — 72 ratings
"Evergreen 100% Success Sample Question Papers in Social Science (CBSE) Class 9 Term-I", "José L. Galvan", Social Science,  3.55 avg rating — 22 ratings
"CBSE Sample Question Papers Class 10 Social Science (For March 2019 Exam)", "EduCart", Social Science,  3.69 avg rating — 16 ratings
"Together with CBSE/NCERT Practice Material Chapterwise for Class 9 Social Science for 2019 Examination", "Namrata Singh", Social Science,  3.94 avg rating — 33 ratings
"Man and Woman in Christ: An Examination of the Roles of Men and Women in Light of Scripture and the Social Sciences", "Anita Jain", Social Science,  3.87 avg rating — 23 ratings
"Awkward: The Science of Why We're Socially Awkward and Why That's Awesome", "Archana Gupta", Social Science,  3.55 avg rating — 1,415 ratings
"Together With Social Science Class - 10", "Stephen B. Clark", Social Science,  4.20 avg rating — 30 ratings
"Cambridge Social Sciences Level 8 Teacher's Manual: Middle School Social Sciences", "Ty Tashiro", Social Science,  3.67 avg rating — 6 ratings
"Feminism and Methodology: Social Science Issues", "Namrata Singh", Social Science,  3.71 avg rating — 48 ratings
"How to Prepare a Dissertation Proposal: Suggestions for Students in Education and the Social and Behavioral Sciences", "Devyani Kapoor", Social Science,  3.67 avg rating — 96 ratings
"Xam Idea Complete Course Social Science Class 10 for 2019 Exam", "Reeta David", Social Science,  3.11 avg rating — 28 ratings
"Generative Social Science: Studies in Agent-Based Computational Modeling", "Madhuri Gupta", Social Science,  4.04 avg rating — 56 ratings
"Introductory Mathematical Analysis for Business, Economics, And the Life And Social Sciences: Student Solutions Manual", "Sandra G. Harding", Social Science,  4.14 avg rating — 22 ratings
"Good Essay Writing: A Social Sciences Guide", "David R. Krathwohl", Social Science,  3.76 avg rating — 130 ratings
"Unthinking Social Science: Limits Of 19Th Century Paradigms", "Nick L. Smith", Social Science,  3.98 avg rating — 46 ratings
"Why Marriage Matters: Twenty-Six Conclusions from the Social Sciences", "VK Global Publications", Social Science,  3.71 avg rating — 14 ratings
"The Social Leap: The New Evolutionary Science of Who We Are, Where We Come From, and What Makes Us Happy", "Joshua M. Epstein", Social Science,  4.25 avg rating — 1,204 ratings
"Animal Farm", "Ernest F. Haeussler Jr.", Social Science,  3.97 avg rating — 3,233,202 ratings
"Learning How to Ask: A Sociolinguistic Appraisal of the Role of the Interview in Social Science Research", "Richard S. Paul", Social Science,  3.87 avg rating — 45 ratings
"Golden Social Science: With Sample Papers Class - 10, Term 1 and 2", "Richard J. Wood", Social Science,  4.25 avg rating — 4 ratings
"Father and Daughter: Patriarchy, Gender, and Social Science", "Peter Redman", Social Science,  3.92 avg rating — 13 ratings
"Ecology: The Link Between the Natural & the Social Sciences", "Immanuel Wallerstein", Social Science,  3.59 avg rating — 123 ratings
"Physics of the Impossible", "Michio Kaku", Physics,  4.08 avg rating — 36,287 ratings
"Seven Brief Lessons on Physics", "Carlo Rovelli", Physics,  3.97 avg rating — 46,774 ratings
"Special Topics in Calamity Physics", "Simon Carnell", Physics,  3.70 avg rating — 45,215 ratings
"Six Easy Pieces: Essentials of Physics By Its Most Brilliant Teacher", "Erica Segre", Physics,  4.21 avg rating — 23,943 ratings
"Physics of the Future: How Science Will Shape Human Destiny and Our Daily Lives by the Year 2100", "Marisha Pessl", Physics,  4.00 avg rating — 16,260 ratings
"In Search of Schrödinger's Cat: Quantum Physics and Reality", "Richard P. Feynman", Physics,  4.05 avg rating — 19,585 ratings
"The Feynman Lectures on Physics", "Michio Kaku", Physics,  4.60 avg rating — 7,348 ratings
"The Tao of Physics: An Exploration of the Parallels between Modern Physics and Eastern Mysticism", "John Gribbin", Physics,  3.95 avg rating — 18,036 ratings
"The Trouble with Physics: The Rise of String Theory, the Fall of a Science and What Comes Next", "Richard P. Feynman", Physics,  4.02 avg rating — 9,519 ratings
"Dancing Wu Li Masters: An Overview of the New Physics", "Robert B. Leighton", Physics,  3.99 avg rating — 10,794 ratings
"What Is Real?: The Unfinished Quest for the Meaning of Quantum Physics", "Matthew L. Sands", Physics,  4.28 avg rating — 2,452 ratings
"The Emperor's New Mind: Concerning Computers, Minds and the Laws of Physics", "Fritjof Capra", Physics,  3.89 avg rating — 6,684 ratings
"Laws of Physics: Motion (Hypothesis, #4)", "Lee Smolin", Physics,  4.16 avg rating — 7,567 ratings
"On the Shoulders of Giants: The Great Works of Physics and Astronomy", "Gary Zukav", Physics,  4.20 avg rating — 4,936 ratings
"Lost in Math: How Beauty Leads Physics Astray", "Adam  Becker", Physics,  4.05 avg rating — 2,214 ratings
"The Theoretical Minimum: What You Need to Know to Start Doing Physics (Theoretical Minimum #1)", "Roger Penrose", Physics,  4.15 avg rating — 2,291 ratings
"For the Love of Physics: From the End of the Rainbow to the Edge of Time - A Journey Through the Wonders of Physics", "Martin Gardner", Physics,  4.25 avg rating — 3,380 ratings
"The Physics of Star Trek", "Penny Reid", Physics,  3.84 avg rating — 5,850 ratings
"Understanding Physics for JEE Main & Advanced Mechanics Part 1", "Stephen Hawking", Physics,  4.05 avg rating — 1,348 ratings
"Modern abc of physics class 11", "Sabine Hossenfelder", Physics,  3.60 avg rating — 174 ratings
"Laws of Physics: Space (Hypothesis, #5)", "Penny Reid", Physics,  4.27 avg rating — 6,583 ratings
"Laws of Physics: Time (Hypothesis, #6)", "Penny Reid", Physics,  4.22 avg rating — 6,100 ratings
"Physics", "Aristotle", Physics,  3.98 avg rating — 3,888 ratings
"Physics and Philosophy: The Revolution in Modern Science", "David Bostock", Physics,  4.03 avg rating — 2,464 ratings
"Feynman's Rainbow: A Search for Beauty in Physics and in Life", "Robin Waterfield", Physics,  4.03 avg rating — 3,271 ratings
"Pradeep's Fundamental Physics for Class 11 - Vol. 1 & 2", "Werner Heisenberg", Physics,  3.58 avg rating — 769 ratings
"Concepts of Physics (Part 2)", "Paul C.W. Davies", Physics,  4.35 avg rating — 1,232 ratings
"Paradox: The Nine Greatest Enigmas in Physics", "Leonard Mlodinow", Physics,  3.98 avg rating — 2,304 ratings
"Pradeep's Fundamental Physics Vol I&II Class - 12 (Pradeep's Fundamental Physics Vol I&II Class - 12)", "K.L. Gomber", Physics,  3.57 avg rating — 591 ratings
"Storm in a Teacup: The Physics of Everyday Life", "K.L. Gogia", Physics,  4.03 avg rating — 3,557 ratings
"Knocking on Heaven's Door: How Physics and Scientific Thinking Illuminate the Universe and the Modern World", "H.C. Verma", Physics,  3.80 avg rating — 2,450 ratings
"The Evolution of Physics: From Early Concepts to Relativity and Quanta", "Jim Al-Khalili", Physics,  4.24 avg rating — 1,595 ratings
"Physics for Future Presidents: The Science Behind the Headlines", "K.L Gomber", Physics,  4.03 avg rating — 2,330 ratings
"Concepts of Physics (Part 1)", "K.L Gogia", Physics,  4.34 avg rating — 1,332 ratings
"Time Reborn: From the Crisis in Physics to the Future of the Universe", "Helen Czerski", Physics,  3.86 avg rating — 1,650 ratings
"Meeting the Universe Halfway: Quantum Physics and the Entanglement of Matter and Meaning", "Lisa Randall", Physics,  4.37 avg rating — 479 ratings
"Foundation Science Physics for Class - 9 (2019-2020) Examination", "Albert Einstein", Physics,  3.94 avg rating — 626 ratings
"Your Brain Is a Time Machine: The Neuroscience and Physics of Time", "Leopold Infeld", Physics,  3.90 avg rating — 1,064 ratings
"My Life as a Quant: Reflections on Physics and Finance", "Richard A. Muller", Physics,  3.77 avg rating — 2,350 ratings
"How to Teach Quantum Physics to Your Dog", "H.C. Verma", Physics,  3.89 avg rating — 2,598 ratings
"The Feynman Lectures on Physics Vol 1", "Richard P. Feynman", Physics,  4.61 avg rating — 1,535 ratings
"Laws of Physics (Hypothesis, #4-6)", "Robert B. Leighton", Physics,  4.39 avg rating — 768 ratings
"Thirty Years that Shook Physics: The Story of Quantum Theory", "Matthew L. Sands", Physics,  4.20 avg rating — 1,114 ratings
"Alice in Quantumland: An Allegory of Quantum Physics", "Penny Reid", Physics,  3.85 avg rating — 1,677 ratings
"The Great Mental Models, Volume 2: Physics, Chemistry and Biology", "George Gamow", Physics,  4.21 avg rating — 1,005 ratings
"Art and Physics: Parallel Visions in Space, Time, and Light", "Robert Gilmore", Physics,  4.14 avg rating — 1,474 ratings
"Fundamentals of Physics", "Shane Parrish", Physics,  4.12 avg rating — 1,828 ratings
"Faraday, Maxwell, and the Electromagnetic Field: How Two Men Revolutionized Physics", "Rhiannon Beaubien", Physics,  4.25 avg rating — 1,194 ratings
"Student Solutions Manual to Accompany Concepts of Modern Physics", "Leonard Shlain", Physics,  4.02 avg rating — 368 ratings
"Nonlinear Dynamics and Chaos: With Applications to Physics, Biology, Chemistry, and Engineering", "David Halliday", Physics,  4.36 avg rating — 1,361 ratings
"Social Physics: How Good Ideas Spread— The Lessons from a New Science", "Robert Resnick", Physics,  3.53 avg rating — 1,216 ratings
"The Physics of Wall Street: A Brief History of Predicting the Unpredictable", "Jearl Walker", Physics,  3.84 avg rating — 1,657 ratings
"Thinking Physics: Understandable Practical Reality", "Nancy  Forbes", Physics,  4.39 avg rating — 348 ratings
"The Physics of Superheroes", "Basil Mahon", Physics,  3.93 avg rating — 2,404 ratings
"S. Chand's Principles of Physics for Class XI", "Arthur Beiser", Physics,  3.89 avg rating — 415 ratings
"The Jazz of Physics: The Secret Link Between Music and the Structure of the Universe", "Steven H. Strogatz", Physics,  3.61 avg rating — 872 ratings
"The World According to Physics", "Alex Pentland", Physics,  4.16 avg rating — 920 ratings
"Dinesh New Millennium Physics Class-11 (Sets of 2 books)", "James Owen Weatherall", Physics,  3.79 avg rating — 248 ratings
"Understanding Physics for JEE Main & Advanced Electricity & Magnetism", "Lewis Carroll Epstein", Physics,  4.34 avg rating — 632 ratings
"Solid State Physics", "James Kakalios", Physics,  3.71 avg rating — 314 ratings
"Quantum Enigma: Physics Encounters Consciousness", "Bruce Rosenblum", Physics,  4.10 avg rating — 2,047 ratings
"Now: The Physics of Time", "Fred Kuttner", Physics,  3.90 avg rating — 1,056 ratings
"New Simplified Physics: A Reference Book - Class 12(Set of 2 Volumes) with Free Car Anti Slip Mat", "Richard A. Muller", Physics,  3.86 avg rating — 332 ratings
"Understanding Physics", "S.L. Arora", Physics,  4.16 avg rating — 933 ratings
"Foundation Science Physics for Class - 10", "Isaac Asimov", Physics,  3.83 avg rating — 395 ratings
"Engineering Physics", "H.C. Verma", Physics,  3.99 avg rating — 330 ratings
"Solid State Physics: Structure and Properties of Materials", "R.K. Gaur", Physics,  3.84 avg rating — 290 ratings
"Stephen Hawking: A Memoir of Friendship and Physics", "S.L. Gupta", Physics,  4.03 avg rating — 354 ratings
"The Physics of Everyday Things: The Extraordinary Science Behind an Ordinary Day", "M.A. Wahab", Physics,  3.28 avg rating — 810 ratings
"Wagga (Alpha Physics, #1)", "Leonard Mlodinow", Physics,  4.41 avg rating — 1,492 ratings
"New Simplified Physics: A Reference Book for Class 11 for 2019 Examination (Set of 2 Volumes)", "James Kakalios", Physics,  3.89 avg rating — 291 ratings
"The Theory of Almost Everything: The Standard Model, the Unsung Triumph of Modern Physics", "Alex Kozlowski", Physics,  4.07 avg rating — 711 ratings
"The Feynman Lectures on Physics Vol 3", "S.L. Arora", Physics,  4.63 avg rating — 951 ratings
"The Age of Entanglement: When Quantum Physics Was Reborn", "Robert Oerter", Physics,  4.02 avg rating — 1,190 ratings
"The Principle of Relativity (Books on Physics)", "Richard P. Feynman", Physics,  4.41 avg rating — 649 ratings
"University Physics with Modern Physics", "Robert B. Leighton", Physics,  4.12 avg rating — 1,307 ratings
"Sciencia: Mathematics, Physics, Chemistry, Biology, and Astronomy for All", "Matthew L. Sands", Physics,  4.25 avg rating — 495 ratings
"The Feynman Lectures on Physics Vol 2", "Louisa Gilder", Physics,  4.63 avg rating — 930 ratings
"50 Physics Ideas You Really Need to Know", "Albert Einstein", Physics,  3.89 avg rating — 891 ratings
"Complete Physics for Cambridge IGCSE", "Hermann Minkowski", Physics,  4.22 avg rating — 281 ratings
"FBP: Federal Bureau of Physics, Vol. 1: The Paradigm Shift", "Simon Oliver", Physics,  3.58 avg rating — 1,540 ratings
"God and the New Physics", "Robbi Rodriguez", Physics,  3.95 avg rating — 1,114 ratings
"The Edge of Physics: A Journey to Earth's Extremes to Unlock the Secrets of the Universe", "Paul C.W. Davies", Physics,  4.00 avg rating — 963 ratings
"Quantum Physics for Babies", "Anil Ananthaswamy", Physics,  4.06 avg rating — 931 ratings
"Science and Cooking: Physics Meets Food, From Homemade to Haute Cuisine", "Chris Ferrie", Physics,  3.98 avg rating — 108 ratings
"Particle Physics: A Very Short Introduction", "Michael P. Brenner", Physics,  3.96 avg rating — 1,040 ratings
"Einstein's Dice and Schrödinger's Cat: How Two Great Minds Battled Quantum Randomness to Create a Unified Theory of Physics", "Pia M. Sörensen", Physics,  3.93 avg rating — 686 ratings
"The Pope of Physics: Enrico Fermi and the Birth of the Atomic Age", "David A. Weitz", Physics,  4.29 avg rating — 646 ratings
"The Physics of Sorrow", "Frank Close", Physics,  4.06 avg rating — 6,863 ratings
"The Physics Book: From the Big Bang to Quantum Resurrection, 250 Milestones in the History of Physics", "Paul Halpern", Physics,  4.10 avg rating — 504 ratings
"The Dreams That Stuff Is Made Of: The Most Astounding Papers of Quantum Physics--and How They Shook the Scientific World", "Gino Segrè", Physics,  4.37 avg rating — 192 ratings
"Understanding Physics for JEE Main & Advanced Waves & Thermodynamics", "Bettina Hoerlin", Physics,  4.32 avg rating — 466 ratings
"Physics for Scientists and Engineers, Volume 2--Student Solutions Manual", "Georgi Gospodinov", Physics,  4.35 avg rating — 246 ratings
"Understanding Physics for JEE Main & Advanced Mechanics Part 2", "Angela Rodel", Physics,  4.36 avg rating — 473 ratings
"The Cartoon Guide to Physics", "Clifford A. Pickover", Physics,  3.96 avg rating — 982 ratings
"My Big TOE - Awakening, Discovey, Inner Workings : The Complete Trilogy Unifying Philosophy, Physics, and Metaphysics", "Stephen Hawking", Physics,  4.42 avg rating — 309 ratings
"Physics for Scientists and Engineers", "D.C. Pandey", Physics,  4.03 avg rating — 566 ratings
"How the Hippies Saved Physics: Science, Counterculture, and the Quantum Revival", "Raymond A. Serway", Physics,  3.53 avg rating — 668 ratings
"The Five Ages of the Universe: Inside the Physics of Eternity", "D.C. Pandey", Physics,  4.23 avg rating — 466 ratings
"Physics and Beyond: Encounters and Conversations", "Larry Gonick", Physics,  4.36 avg rating — 884 ratings
